{"expected":[{"x-icap-error-details":null,"cs-uri-path":"/tests/testconnectivity.asp","rs(Content-Type)":"text/html","s-supplier-name":"www.ositis.com","cs-method":"GET","sc-filter-category":"none","time":[18,27,21],"s-action":"TCP_NC_MISS","sc-bytes":186,"date":[2005,4,5],"x-virus-id":null,"sc-filter-result":"PROXIED","cs-username":null,"cs-uri-query":"?Test=16246","s-sitename":"SG-HTTP-Service","time-taken":75.0,"x-icap-error-code":"none","s-ip":"10.2.13.200","c-ip":"10.0.1.2","cs-bytes":231,"cs-uri-scheme":"http","s-hierarchy":"DIRECT","cs(User-Agent)":"Mozilla/4.0 (compatible; ProxyAV)","cs-host":"www.ositis.com","x-virus-details":null,"sc-status":200},{"cs-username":null,"cs-uri-scheme":"http","x-virus-details":null,"c-ip":"10.0.1.2","cs-uri-query":"?","time-taken":157.0,"date":[2005,4,5],"time":[18,36,57],"cs-host":"www.ositis.com","s-ip":"10.2.13.200","rs(Content-Type)":"application/octet-stream","cs(User-Agent)":"Mozilla/4.0 (compatible; ProxyAV)","sc-status":200,"sc-filter-category":"none","s-supplier-name":"www.ositis.com","x-icap-error-details":null,"x-icap-error-code":"none","s-action":"TCP_CLIENT_REFRESH","s-hierarchy":"DIRECT","sc-bytes":372,"s-sitename":"SG-HTTP-Service","sc-filter-result":"PROXIED","cs-method":"GET","cs-bytes":247,"cs-uri-path":"/UpdateLocation/ProxyAV/McafeeAntivirusEngineLocation","x-virus-id":null},{"cs-uri-query":"?","x-virus-details":null,"s-supplier-name":"www.ositis.com","sc-status":200,"x-virus-id":null,"cs-host":"www.ositis.com","cs-bytes":248,"x-icap-error-details":null,"cs-uri-path":"/UpdateLocation/ProxyAV/McafeeAntivirusPatternLocation","s-hierarchy":"DIRECT","sc-filter-category":"none","time":[18,36,57],"cs(User-Agent)":"Mozilla/4.0 (compatible; ProxyAV)","x-icap-error-code":"none","cs-uri-scheme":"http","s-sitename":"SG-HTTP-Service","rs(Content-Type)":"application/octet-stream","s-ip":"10.2.13.200","sc-filter-result":"PROXIED","time-taken":226.0,"cs-username":null,"date":[2005,4,5],"s-action":"TCP_CLIENT_REFRESH","cs-method":"GET","sc-bytes":388,"c-ip":"10.0.1.2"},{"c-ip":"10.0.1.2","sc-bytes":234,"cs-uri-scheme":"http","s-ip":"10.2.13.200","cs-method":"GET","x-virus-details":null,"time":[18,52,57],"x-icap-error-details":null,"cs-username":null,"cs-uri-query":null,"sc-status":200,"cs-host":"www.ositis.com","time-taken":106.0,"cs(User-Agent)":"Mozilla/4.0 (compatible; ProxyAV)","rs(Content-Type)":"text/html","x-virus-id":null,"sc-filter-result":"PROXIED","date":[2005,4,5],"cs-bytes":213,"s-sitename":"SG-HTTP-Service","x-icap-error-code":"none","sc-filter-category":"none","cs-uri-path":"/cgi-bin/DNSList.asp","s-supplier-name":"www.ositis.com","s-action":"TCP_NC_MISS","s-hierarchy":"DIRECT"},{"cs-uri-scheme":"http","cs-username":null,"date":[2005,4,5],"s-ip":"10.2.13.200","sc-filter-result":"PROXIED","s-action":"TCP_NC_MISS","x-icap-error-details":null,"cs-host":"download.bluecoat.com","rs(Content-Type)":"text/html","x-icap-error-code":"none","time":[18,54,1],"c-ip":"10.0.1.2","s-hierarchy":"DIRECT","cs-method":"GET","sc-filter-category":"none","x-virus-id":null,"sc-bytes":521,"cs(User-Agent)":"Mozilla/4.0 (compatible; ProxyAV)","sc-status":200,"cs-uri-path":"/release/ProxyAV/2.2.1/2000E/update-22.asp","x-virus-details":null,"s-supplier-name":"download.bluecoat.com","cs-uri-query":"?6331CC061172FD431277923B7C71FA7489DC1E556B0A3C31AA8F2056179E104EAEAFBAD3463C62D211CF3B2692F89F77762544B07F5352FB98FC236B368C3EBD2988810A4F87E0880F8628F7FD59AFAFD484C64ED882337FAE5819AB291DABB8AFBC6FA3488637FED8185C8DB168FB2722F9395FD5C631B5C1294195446CD04854","time-taken":133.0,"s-sitename":"SG-HTTP-Service","cs-bytes":508},{"x-icap-error-code":"none","s-ip":"10.2.13.200","x-virus-details":null,"cs-bytes":231,"cs-uri-path":"/tests/testconnectivity.asp","sc-filter-category":"none","rs(Content-Type)":"text/html","time-taken":280.0,"cs-uri-query":"?Test=22634","date":[2005,4,5],"cs-uri-scheme":"http","cs-host":"www.ositis.com","cs-method":"GET","cs-username":null,"s-sitename":"SG-HTTP-Service","c-ip":"10.0.1.2","x-icap-error-details":null,"s-supplier-name":"www.ositis.com","sc-bytes":186,"sc-status":200,"cs(User-Agent)":"Mozilla/4.0 (compatible; ProxyAV)","x-virus-id":null,"time":[19,1,29],"sc-filter-result":"PROXIED","s-hierarchy":"DIRECT","s-action":"TCP_NC_MISS"},{"s-action":"TCP_CLIENT_REFRESH","x-icap-error-details":null,"x-virus-id":null,"cs-bytes":248,"x-virus-details":null,"s-supplier-name":"www.ositis.com","sc-status":200,"cs-uri-query":"?","time-taken":164.0,"sc-filter-category":"none","cs-host":"www.ositis.com","sc-bytes":388,"x-icap-error-code":"none","s-hierarchy":"DIRECT","cs-username":null,"cs-uri-path":"/UpdateLocation/ProxyAV/McafeeAntivirusPatternLocation","cs(User-Agent)":"Mozilla/4.0 (compatible; ProxyAV)","time":[19,7,21],"rs(Content-Type)":"application/octet-stream","sc-filter-result":"PROXIED","date":[2005,4,5],"c-ip":"10.0.1.2","s-ip":"10.2.13.200","cs-uri-scheme":"http","cs-method":"GET","s-sitename":"SG-HTTP-Service"},{"x-virus-id":null,"x-virus-details":null,"s-supplier-name":"www.ositis.com","time-taken":252.0,"time":[19,7,21],"cs-uri-path":"/UpdateLocation/ProxyAV/McafeeAntivirusEngineLocation","c-ip":"10.0.1.2","sc-status":200,"cs-username":null,"sc-filter-result":"PROXIED","s-action":"TCP_CLIENT_REFRESH","s-sitename":"SG-HTTP-Service","cs-method":"GET","cs-host":"www.ositis.com","x-icap-error-details":null,"date":[2005,4,5],"rs(Content-Type)":"application/octet-stream","cs-uri-scheme":"http","cs(User-Agent)":"Mozilla/4.0 (compatible; ProxyAV)","cs-uri-query":"?","x-icap-error-code":"none","cs-bytes":247,"s-ip":"10.2.13.200","sc-filter-category":"none","sc-bytes":372,"s-hierarchy":"DIRECT"},{"cs-uri-scheme":"http","x-icap-error-details":null,"s-ip":"10.2.13.200","s-supplier-name":"www.ositis.com","cs-bytes":248,"time-taken":84.0,"c-ip":"10.0.1.2","cs-host":"www.ositis.com","sc-filter-category":"none","time":[19,9,29],"cs(User-Agent)":"Mozilla/4.0 (compatible; ProxyAV)","sc-status":200,"s-sitename":"SG-HTTP-Service","s-action":"TCP_CLIENT_REFRESH","rs(Content-Type)":"application/octet-stream","cs-method":"GET","cs-uri-path":"/UpdateLocation/ProxyAV/McafeeAntivirusPatternLocation","x-virus-details":null,"s-hierarchy":"DIRECT","sc-bytes":388,"cs-uri-query":"?","x-virus-id":null,"sc-filter-result":"PROXIED","date":[2005,4,5],"cs-username":null,"x-icap-error-code":"none"},{"s-action":"TCP_CLIENT_REFRESH","sc-status":200,"cs-uri-path":"/UpdateLocation/ProxyAV/McafeeAntivirusEngineLocation","cs-method":"GET","s-supplier-name":"www.ositis.com","date":[2005,4,5],"c-ip":"10.0.1.2","s-hierarchy":"DIRECT","x-virus-id":null,"x-icap-error-code":"none","s-sitename":"SG-HTTP-Service","sc-bytes":372,"time-taken":86.0,"cs(User-Agent)":"Mozilla/4.0 (compatible; ProxyAV)","cs-host":"www.ositis.com","x-virus-details":null,"cs-username":null,"x-icap-error-details":null,"cs-bytes":247,"rs(Content-Type)":"application/octet-stream","cs-uri-query":"?","time":[19,9,29],"cs-uri-scheme":"http","s-ip":"10.2.13.200","sc-filter-category":"none","sc-filter-result":"PROXIED"},{"cs-method":"GET","x-icap-error-code":"none","sc-bytes":186,"time":[19,35,37],"sc-filter-result":"PROXIED","cs-uri-query":"?Test=21010","date":[2005,4,5],"s-sitename":"SG-HTTP-Service","cs-username":null,"cs-uri-path":"/tests/testconnectivity.asp","cs-host":"www.ositis.com","s-ip":"10.2.13.200","cs(User-Agent)":"Mozilla/4.0 (compatible; ProxyAV)","c-ip":"10.0.1.2","s-supplier-name":"www.ositis.com","cs-uri-scheme":"http","s-hierarchy":"DIRECT","rs(Content-Type)":"text/html","s-action":"TCP_NC_MISS","x-virus-id":null,"x-icap-error-details":null,"time-taken":196.0,"sc-filter-category":"none","cs-bytes":231,"sc-status":200,"x-virus-details":null},{"c-ip":"10.0.1.2","cs-username":null,"cs-method":"GET","x-icap-error-details":null,"cs-bytes":247,"s-sitename":"SG-HTTP-Service","sc-status":200,"cs-uri-query":"?","sc-filter-category":"none","s-supplier-name":"www.ositis.com","s-hierarchy":"DIRECT","time-taken":339.0,"cs(User-Agent)":"Mozilla/4.0 (compatible; ProxyAV)","date":[2005,4,5],"cs-uri-scheme":"http","rs(Content-Type)":"application/octet-stream","s-ip":"10.2.13.200","x-virus-id":null,"cs-uri-path":"/UpdateLocation/ProxyAV/McafeeAntivirusEngineLocation","time":[19,39,53],"sc-filter-result":"PROXIED","s-action":"TCP_CLIENT_REFRESH","sc-bytes":372,"x-icap-error-code":"none","cs-host":"www.ositis.com","x-virus-details":null},{"s-hierarchy":"DIRECT","rs(Content-Type)":"application/octet-stream","cs-uri-path":"/UpdateLocation/ProxyAV/McafeeAntivirusPatternLocation","cs(User-Agent)":"Mozilla/4.0 (compatible; ProxyAV)","x-icap-error-details":null,"cs-uri-scheme":"http","c-ip":"10.0.1.2","sc-status":200,"cs-method":"GET","date":[2005,4,5],"cs-uri-query":"?","sc-filter-category":"none","cs-bytes":248,"sc-bytes":388,"s-sitename":"SG-HTTP-Service","s-action":"TCP_CLIENT_REFRESH","time":[19,39,53],"s-supplier-name":"www.ositis.com","time-taken":403.0,"cs-username":null,"x-icap-error-code":"none","x-virus-details":null,"sc-filter-result":"PROXIED","cs-host":"www.ositis.com","s-ip":"10.2.13.200","x-virus-id":null},{"s-action":"TCP_CLIENT_REFRESH","cs-uri-scheme":"http","sc-filter-result":"PROXIED","s-ip":"10.2.13.200","time":[19,42,1],"sc-status":200,"s-sitename":"SG-HTTP-Service","x-icap-error-code":"none","cs(User-Agent)":"Mozilla/4.0 (compatible; ProxyAV)","cs-uri-path":"/UpdateLocation/ProxyAV/McafeeAntivirusEngineLocation","cs-username":null,"time-taken":107.0,"s-hierarchy":"DIRECT","x-icap-error-details":null,"cs-host":"www.ositis.com","date":[2005,4,5],"cs-uri-query":"?","rs(Content-Type)":"application/octet-stream","cs-bytes":247,"c-ip":"10.0.1.2","sc-bytes":372,"x-virus-details":null,"s-supplier-name":"www.ositis.com","cs-method":"GET","sc-filter-category":"none","x-virus-id":null},{"sc-bytes":388,"cs(User-Agent)":"Mozilla/4.0 (compatible; ProxyAV)","s-ip":"10.2.13.200","s-sitename":"SG-HTTP-Service","sc-status":200,"cs-bytes":248,"time":[19,42,1],"cs-host":"www.ositis.com","cs-uri-path":"/UpdateLocation/ProxyAV/McafeeAntivirusPatternLocation","time-taken":107.0,"c-ip":"10.0.1.2","x-icap-error-code":"none","x-virus-id":null,"cs-uri-query":"?","date":[2005,4,5],"x-virus-details":null,"cs-username":null,"s-supplier-name":"www.ositis.com","cs-method":"GET","s-hierarchy":"DIRECT","sc-filter-category":"none","s-action":"TCP_CLIENT_REFRESH","sc-filter-result":"PROXIED","rs(Content-Type)":"application/octet-stream","cs-uri-scheme":"http","x-icap-error-details":null},{"cs-host":"www.yahoo.com","sc-filter-result":"DENIED","x-virus-id":null,"s-action":"TCP_DENIED","cs-uri-path":"/support/index.html","time-taken":27.0,"s-sitename":"SG-HTTP-Service","sc-status":403,"s-supplier-name":null,"x-icap-error-details":null,"sc-bytes":775,"c-ip":"10.2.13.59","cs-bytes":623,"rs(Content-Type)":null,"x-virus-details":null,"cs-username":null,"cs-uri-query":null,"sc-filter-category":"none","s-hierarchy":"NONE","cs-method":"GET","s-ip":"10.2.13.200","cs(User-Agent)":"Mozilla/5.0 (Windows; U; Windows NT 5.1; en-US; rv:1.7.5) Gecko/20041107 Firefox/1.0","date":[2005,4,5],"time":[19,58,49],"x-icap-error-code":null,"cs-uri-scheme":"http"},{"s-action":"TCP_DENIED","cs(User-Agent)":"Mozilla/5.0 (Windows; U; Windows NT 5.1; en-US; rv:1.7.5) Gecko/20041107 Firefox/1.0","sc-status":403,"s-ip":"10.2.13.200","sc-bytes":775,"time-taken":1.0,"date":[2005,4,5],"x-icap-error-details":null,"cs-host":"www.yahoo.com","cs-uri-scheme":"http","cs-username":null,"c-ip":"10.2.13.59","cs-uri-path":"/","cs-method":"GET","rs(Content-Type)":null,"s-sitename":"SG-HTTP-Service","x-virus-id":null,"time":[19,58,54],"s-hierarchy":"NONE","cs-bytes":492,"sc-filter-category":"none","sc-filter-result":"DENIED","s-supplier-name":null,"cs-uri-query":null,"x-virus-details":null,"x-icap-error-code":null},{"cs(User-Agent)":"Mozilla/5.0 (Windows; U; Windows NT 5.1; en-US; rv:1.7.5) Gecko/20041107 Firefox/1.0","rs(Content-Type)":"text/html","cs-method":"GET","time":[19,59,14],"x-virus-id":null,"s-action":"TCP_NC_MISS","s-supplier-name":"www.yahoo.com","cs-bytes":516,"time-taken":876.0,"cs-uri-scheme":"http","sc-filter-result":"PROXIED","cs-username":null,"sc-bytes":35320,"cs-uri-query":null,"x-virus-details":null,"s-hierarchy":"DIRECT","sc-filter-category":"none","cs-uri-path":"/","s-sitename":"SG-HTTP-Service","x-icap-error-details":null,"cs-host":"www.yahoo.com","c-ip":"10.2.13.59","sc-status":200,"s-ip":"10.2.13.200","x-icap-error-code":"none","date":[2005,4,5]},{"time-taken":6.0,"x-icap-error-details":null,"s-hierarchy":"DIRECT","x-virus-details":null,"cs-username":null,"sc-filter-category":"none","time":[19,59,14],"x-icap-error-code":"none","sc-bytes":2129,"x-virus-id":null,"s-action":"TCP_RESCAN_HIT","cs-uri-scheme":"http","cs(User-Agent)":"Mozilla/5.0 (Windows; U; Windows NT 5.1; en-US; rv:1.7.5) Gecko/20041107 Firefox/1.0","rs(Content-Type)":"image/gif","cs-method":"GET","cs-uri-path":"/us.yimg.com/i/ww/beta/y3.gif","sc-filter-result":"PROXIED","sc-status":200,"s-sitename":"SG-HTTP-Service","cs-uri-query":null,"date":[2005,4,5],"s-supplier-name":"38.119.82.22","cs-host":"us.a1.yimg.com","cs-bytes":431,"s-ip":"10.2.13.200","c-ip":"10.2.13.59"},{"sc-filter-category":"none","x-icap-error-code":"none","cs-uri-path":"/us.yimg.com/i/ww/bt1/ml.gif","time-taken":5.0,"rs(Content-Type)":"image/gif","c-ip":"10.2.13.59","cs-username":null,"cs-uri-query":null,"time":[19,59,14],"cs(User-Agent)":"Mozilla/5.0 (Windows; U; Windows NT 5.1; en-US; rv:1.7.5) Gecko/20041107 Firefox/1.0","x-icap-error-details":null,"date":[2005,4,5],"s-ip":"10.2.13.200","sc-bytes":941,"cs-method":"GET","s-sitename":"SG-HTTP-Service","cs-uri-scheme":"http","s-hierarchy":"DIRECT","sc-status":200,"x-virus-details":null,"s-supplier-name":"38.119.82.23","cs-bytes":430,"x-virus-id":null,"cs-host":"us.i1.yimg.com","sc-filter-result":"PROXIED","s-action":"TCP_RESCAN_HIT"},{"cs-username":null,"x-virus-id":null,"date":[2005,4,5],"rs(Content-Type)":"image/gif","cs-host":"us.i1.yimg.com","sc-filter-category":"none","cs-method":"GET","s-supplier-name":"38.119.82.23","cs(User-Agent)":"Mozilla/5.0 (Windows; U; Windows NT 5.1; en-US; rv:1.7.5) Gecko/20041107 Firefox/1.0","cs-uri-path":"/us.yimg.com/i/ww/bt1/125.gif","x-icap-error-details":null,"s-ip":"10.2.13.200","s-sitename":"SG-HTTP-Service","s-action":"TCP_RESCAN_HIT","x-icap-error-code":"none","x-virus-details":null,"cs-bytes":431,"sc-filter-result":"PROXIED","cs-uri-scheme":"http","sc-bytes":1122,"c-ip":"10.2.13.59","time-taken":59.0,"cs-uri-query":null,"s-hierarchy":"DIRECT","time":[19,59,14],"sc-status":200},{"cs-uri-path":"/us.yimg.com/i/ww/bt1/my.gif","date":[2005,4,5],"cs-method":"GET","x-virus-id":null,"cs(User-Agent)":"Mozilla/5.0 (Windows; U; Windows NT 5.1; en-US; rv:1.7.5) Gecko/20041107 Firefox/1.0","sc-filter-category":"none","cs-host":"us.i1.yimg.com","sc-filter-result":"PROXIED","time-taken":12.0,"cs-username":null,"x-icap-error-code":"none","c-ip":"10.2.13.59","s-ip":"10.2.13.200","s-action":"TCP_RESCAN_HIT","x-icap-error-details":null,"time":[19,59,14],"sc-status":200,"s-supplier-name":"38.119.82.23","cs-uri-query":null,"x-virus-details":null,"cs-uri-scheme":"http","rs(Content-Type)":"image/gif","sc-bytes":1103,"s-hierarchy":"DIRECT","s-sitename":"SG-HTTP-Service","cs-bytes":430}],"input":"#Software: SGOS 3.2.4.8\r\n#Version: 1.0\r\n#Date: 2005-03-31 01:19:51\r\n#Fields: date time time-taken c-ip sc-status s-action sc-bytes cs-bytes cs-method cs-uri-scheme cs-host cs-uri-path cs-uri-query cs-username s-hierarchy s-supplier-name rs(Content-Type) cs(User-Agent) sc-filter-result sc-filter-category x-virus-id s-ip s-sitename x-virus-details x-icap-error-code x-icap-error-details\r\n2005-04-05 18:27:21 75 10.0.1.2 200 TCP_NC_MISS 186 231 GET http www.ositis.com /tests/testconnectivity.asp ?Test=16246 - DIRECT www.ositis.com text/html \"Mozilla/4.0 (compatible; ProxyAV)\" PROXIED none - 10.2.13.200 SG-HTTP-Service - none -\r\n2005-04-05 18:36:57 157 10.0.1.2 200 TCP_CLIENT_REFRESH 372 247 GET http www.ositis.com /UpdateLocation/ProxyAV/McafeeAntivirusEngineLocation ? - DIRECT www.ositis.com application/octet-stream \"Mozilla/4.0 (compatible; ProxyAV)\" PROXIED none - 10.2.13.200 SG-HTTP-Service - none -\r\n2005-04-05 18:36:57 226 10.0.1.2 200 TCP_CLIENT_REFRESH 388 248 GET http www.ositis.com /UpdateLocation/ProxyAV/McafeeAntivirusPatternLocation ? - DIRECT www.ositis.com application/octet-stream \"Mozilla/4.0 (compatible; ProxyAV)\" PROXIED none - 10.2.13.200 SG-HTTP-Service - none -\r\n2005-04-05 18:52:57 106 10.0.1.2 200 TCP_NC_MISS 234 213 GET http www.ositis.com /cgi-bin/DNSList.asp - - DIRECT www.ositis.com text/html \"Mozilla/4.0 (compatible; ProxyAV)\" PROXIED none - 10.2.13.200 SG-HTTP-Service - none -\r\n2005-04-05 18:54:01 133 10.0.1.2 200 TCP_NC_MISS 521 508 GET http download.bluecoat.com /release/ProxyAV/2.2.1/2000E/update-22.asp ?6331CC061172FD431277923B7C71FA7489DC1E556B0A3C31AA8F2056179E104EAEAFBAD3463C62D211CF3B2692F89F77762544B07F5352FB98FC236B368C3EBD2988810A4F87E0880F8628F7FD59AFAFD484C64ED882337FAE5819AB291DABB8AFBC6FA3488637FED8185C8DB168FB2722F9395FD5C631B5C1294195446CD04854 - DIRECT download.bluecoat.com text/html \"Mozilla/4.0 (compatible; ProxyAV)\" PROXIED none - 10.2.13.200 SG-HTTP-Service - none -\r\n2005-04-05 19:01:29 280 10.0.1.2 200 TCP_NC_MISS 186 231 GET http www.ositis.com /tests/testconnectivity.asp ?Test=22634 - DIRECT www.ositis.com text/html \"Mozilla/4.0 (compatible; ProxyAV)\" PROXIED none - 10.2.13.200 SG-HTTP-Service - none -\r\n2005-04-05 19:07:21 164 10.0.1.2 200 TCP_CLIENT_REFRESH 388 248 GET http www.ositis.com /UpdateLocation/ProxyAV/McafeeAntivirusPatternLocation ? - DIRECT www.ositis.com application/octet-stream \"Mozilla/4.0 (compatible; ProxyAV)\" PROXIED none - 10.2.13.200 SG-HTTP-Service - none -\r\n2005-04-05 19:07:21 252 10.0.1.2 200 TCP_CLIENT_REFRESH 372 247 GET http www.ositis.com /UpdateLocation/ProxyAV/McafeeAntivirusEngineLocation ? - DIRECT www.ositis.com application/octet-stream \"Mozilla/4.0 (compatible; ProxyAV)\" PROXIED none - 10.2.13.200 SG-HTTP-Service - none -\r\n2005-04-05 19:09:29 84 10.0.1.2 200 TCP_CLIENT_REFRESH 388 248 GET http www.ositis.com /UpdateLocation/ProxyAV/McafeeAntivirusPatternLocation ? - DIRECT www.ositis.com application/octet-stream \"Mozilla/4.0 (compatible; ProxyAV)\" PROXIED none - 10.2.13.200 SG-HTTP-Service - none -\r\n2005-04-05 19:09:29 86 10.0.1.2 200 TCP_CLIENT_REFRESH 372 247 GET http www.ositis.com /UpdateLocation/ProxyAV/McafeeAntivirusEngineLocation ? - DIRECT www.ositis.com application/octet-stream \"Mozilla/4.0 (compatible; ProxyAV)\" PROXIED none - 10.2.13.200 SG-HTTP-Service - none -\r\n2005-04-05 19:35:37 196 10.0.1.2 200 TCP_NC_MISS 186 231 GET http www.ositis.com /tests/testconnectivity.asp ?Test=21010 - DIRECT www.ositis.com text/html \"Mozilla/4.0 (compatible; ProxyAV)\" PROXIED none - 10.2.13.200 SG-HTTP-Service - none -\r\n2005-04-05 19:39:53 339 10.0.1.2 200 TCP_CLIENT_REFRESH 372 247 GET http www.ositis.com /UpdateLocation/ProxyAV/McafeeAntivirusEngineLocation ? - DIRECT www.ositis.com application/octet-stream \"Mozilla/4.0 (compatible; ProxyAV)\" PROXIED none - 10.2.13.200 SG-HTTP-Service - none -\r\n2005-04-05 19:39:53 403 10.0.1.2 200 TCP_CLIENT_REFRESH 388 248 GET http www.ositis.com /UpdateLocation/ProxyAV/McafeeAntivirusPatternLocation ? - DIRECT www.ositis.com application/octet-stream \"Mozilla/4.0 (compatible; ProxyAV)\" PROXIED none - 10.2.13.200 SG-HTTP-Service - none -\r\n2005-04-05 19:42:01 107 10.0.1.2 200 TCP_CLIENT_REFRESH 372 247 GET http www.ositis.com /UpdateLocation/ProxyAV/McafeeAntivirusEngineLocation ? - DIRECT www.ositis.com application/octet-stream \"Mozilla/4.0 (compatible; ProxyAV)\" PROXIED none - 10.2.13.200 SG-HTTP-Service - none -\r\n2005-04-05 19:42:01 107 10.0.1.2 200 TCP_CLIENT_REFRESH 388 248 GET http www.ositis.com /UpdateLocation/ProxyAV/McafeeAntivirusPatternLocation ? - DIRECT www.ositis.com application/octet-stream \"Mozilla/4.0 (compatible; ProxyAV)\" PROXIED none - 10.2.13.200 SG-HTTP-Service - none -\r\n#Software: SGOS 3.2.4.8\r\n#Version: 1.0\r\n#Date: 2005-03-31 01:19:51\r\n#Fields: date time time-taken c-ip sc-status s-action sc-bytes cs-bytes cs-method cs-uri-scheme cs-host cs-uri-path cs-uri-query cs-username s-hierarchy s-supplier-name rs(Content-Type) cs(User-Agent) sc-filter-result sc-filter-category x-virus-id s-ip s-sitename x-virus-details x-icap-error-code x-icap-error-details\r\n2005-04-05 19:58:49 27 10.2.13.59 403 TCP_DENIED 775 623 GET http www.yahoo.com /support/index.html - - NONE - - \"Mozilla/5.0 (Windows; U; Windows NT 5.1; en-US; rv:1.7.5) Gecko/20041107 Firefox/1.0\" DENIED none - 10.2.13.200 SG-HTTP-Service - - -\r\n2005-04-05 19:58:54 1 10.2.13.59 403 TCP_DENIED 775 492 GET http www.yahoo.com / - - NONE - - \"Mozilla/5.0 (Windows; U; Windows NT 5.1; en-US; rv:1.7.5) Gecko/20041107 Firefox/1.0\" DENIED none - 10.2.13.200 SG-HTTP-Service - - -\r\n2005-04-05 19:59:14 876 10.2.13.59 200 TCP_NC_MISS 35320 516 GET http www.yahoo.com / - - DIRECT www.yahoo.com text/html \"Mozilla/5.0 (Windows; U; Windows NT 5.1; en-US; rv:1.7.5) Gecko/20041107 Firefox/1.0\" PROXIED none - 10.2.13.200 SG-HTTP-Service - none -\r\n2005-04-05 19:59:14 6 10.2.13.59 200 TCP_RESCAN_HIT 2129 431 GET http us.a1.yimg.com /us.yimg.com/i/ww/beta/y3.gif - - DIRECT 38.119.82.22 image/gif \"Mozilla/5.0 (Windows; U; Windows NT 5.1; en-US; rv:1.7.5) Gecko/20041107 Firefox/1.0\" PROXIED none - 10.2.13.200 SG-HTTP-Service - none -\r\n2005-04-05 19:59:14 5 10.2.13.59 200 TCP_RESCAN_HIT 941 430 GET http us.i1.yimg.com /us.yimg.com/i/ww/bt1/ml.gif - - DIRECT 38.119.82.23 image/gif \"Mozilla/5.0 (Windows; U; Windows NT 5.1; en-US; rv:1.7.5) Gecko/20041107 Firefox/1.0\" PROXIED none - 10.2.13.200 SG-HTTP-Service - none -\r\n2005-04-05 19:59:14 59 10.2.13.59 200 TCP_RESCAN_HIT 1122 431 GET http us.i1.yimg.com /us.yimg.com/i/ww/bt1/125.gif - - DIRECT 38.119.82.23 image/gif \"Mozilla/5.0 (Windows; U; Windows NT 5.1; en-US; rv:1.7.5) Gecko/20041107 Firefox/1.0\" PROXIED none - 10.2.13.200 SG-HTTP-Service - none -\r\n2005-04-05 19:59:14 12 10.2.13.59 200 TCP_RESCAN_HIT 1103 430 GET http us.i1.yimg.com /us.yimg.com/i/ww/bt1/my.gif - - DIRECT 38.119.82.23 image/gif \"Mozilla/5.0 (Windows; U; Windows NT 5.1; en-US; rv:1.7.5) Gecko/20041107 Firefox/1.0\" PROXIED none - 10.2.13.200 SG-HTTP-Service - none -\r\n"}