{"expected":[{"cs-method":"GET","cs-uri-extension":"crl","s-supplier-ip":"196.168.1.1","s-supplier-name":"crl.usertrust.com","x-rs-ocsp-error":null,"sc-filter-result":"OBSERVED","cs-bytes":223,"cs-uri-query":null,"x-bluecoat-application-operation":"none","x-rs-connection-negotiated-cipher-strength":"none","time":[22,19,11],"cs(User-Agent)":"Microsoft-CryptoAPI/10.0","x-bluecoat-reference-id":"CPL-SP-A_Auth-BP-UA","time-taken":70.0,"rs(Content-Type)":"text/html","x-rs-certificate-hostname-category":null,"cs-ip":"196.168.1.1","x-rs-certificate-observed-errors":null,"cs-threat-risk":"unavailable","x-cs-ocsp-error":null,"sc-status":503,"cs-username":null,"s-supplier-failures":null,"s-supplier-country":"None","cs-host":"crl.usertrust.com","cs-auth-group":null,"x-cs-connection-negotiated-ssl-version":null,"cs-uri-scheme":"http","date":[2018,2,2],"x-rs-certificate-hostname-threat-risk":null,"x-virus-id":null,"s-action":"TCP_NC_MISS","cs-uri-port":80,"x-exception-id":null,"s-ip":"196.168.1.1","x-cs-connection-negotiated-cipher-strength":"none","cs-categories":"Non-Viewable/Infrastructure","cs(Referer)":null,"c-ip":"196.168.1.1","sc-bytes":15513,"x-rs-certificate-hostname":null,"x-bluecoat-application-name":"none","cs(Accept-Language)":null,"cs-uri-path":"/UTN-USERFirst-Object.crl","c-connect-type":"Transparent"},{"x-cs-connection-negotiated-ssl-version":null,"x-cs-connection-negotiated-cipher-strength":"none","c-connect-type":"Transparent","rs(Content-Type)":"application/octet-stream","cs-uri-query":null,"time":[22,19,11],"s-supplier-country":"None","cs(Accept-Language)":null,"x-rs-certificate-hostname-threat-risk":null,"date":[2018,2,2],"cs(Referer)":null,"x-exception-id":null,"cs(User-Agent)":"Microsoft BITS/7.8","cs-host":"www.google.com","s-ip":"196.168.1.1","cs-uri-extension":"crx3","cs-uri-scheme":"http","x-virus-id":null,"x-rs-certificate-observed-errors":null,"s-supplier-failures":null,"x-bluecoat-application-operation":"none","sc-bytes":38992,"cs-auth-group":null,"time-taken":182.0,"x-rs-ocsp-error":null,"x-rs-certificate-hostname-category":null,"sc-filter-result":"OBSERVED","c-ip":"196.168.1.1","x-rs-certificate-hostname":null,"x-bluecoat-application-name":"none","x-cs-ocsp-error":null,"s-supplier-ip":"196.168.1.1","sc-status":206,"x-rs-connection-negotiated-cipher-strength":"none","x-bluecoat-reference-id":"CPL-SP-A_Auth-BP-UA","cs-categories":"Search Engines/Portals","cs-method":"GET","cs-uri-path":"/dl/release2/chrome_component/VCUauoj7Hfs_28.0.0.161/28.0.0.161_win64_PepperFlashPlayer.crx3","cs-username":null,"cs-threat-risk":"unavailable","cs-uri-port":80,"s-supplier-name":"www.google.com","cs-bytes":311,"s-action":"TCP_NC_MISS","cs-ip":"196.168.1.1"},{"x-rs-certificate-hostname-category":null,"sc-filter-result":"OBSERVED","c-ip":"196.168.1.1","cs-uri-port":80,"cs-method":"GET","x-bluecoat-application-operation":"none","c-connect-type":"Transparent","cs-uri-scheme":"http","rs(Content-Type)":"text/html","cs-username":null,"cs-categories":"Content Servers","x-rs-certificate-observed-errors":null,"x-rs-certificate-hostname-threat-risk":null,"s-supplier-ip":"196.168.1.1","s-action":"TCP_NC_MISS","x-virus-id":null,"cs-uri-path":"/edgedl/chromewebstore/L2Nocm9tZV9leHRlbnNpb24vYmxvYnMvNjBjQUFWZ1QtVG9Nc3VfVEtEYmd4aG5tZw/6417.1211.0.0_pkedcjkdefgpdelpbcmbmeomcjbeemfm.crx","x-cs-connection-negotiated-ssl-version":null,"cs-uri-extension":"crx","x-rs-certificate-hostname":null,"s-supplier-failures":null,"s-ip":"196.168.1.1","cs-bytes":402,"sc-status":503,"cs-threat-risk":"unavailable","x-bluecoat-reference-id":"WA-SP-A_Standard-Allow","s-supplier-country":"None","cs-host":"redirector.gvt1.com","time-taken":89.0,"time":[22,19,11],"x-bluecoat-application-name":"none","x-cs-ocsp-error":null,"cs(User-Agent)":"Mozilla/5.0 (Windows NT 10.0; Win64; x64) AppleWebKit/537.36 (KHTML, like Gecko) Chrome/64.0.3282.119 Safari/537.36","cs(Accept-Language)":"en;q=0.9","sc-bytes":15747,"x-cs-connection-negotiated-cipher-strength":"none","x-rs-ocsp-error":null,"cs(Referer)":null,"s-supplier-name":"redirector.gvt1.com","x-rs-connection-negotiated-cipher-strength":"none","cs-uri-query":null,"x-exception-id":null,"cs-ip":"196.168.1.1","cs-auth-group":null,"date":[2018,2,2]},{"x-rs-certificate-hostname-threat-risk":null,"rs(Content-Type)":"text/plain;charset=UTF-8","x-rs-certificate-hostname":null,"cs-auth-group":null,"time-taken":194.0,"x-exception-id":null,"x-cs-connection-negotiated-cipher-strength":"none","x-cs-connection-negotiated-ssl-version":null,"sc-filter-result":"OBSERVED","time":[22,19,11],"cs-uri-path":"/mapi.jsp","x-virus-id":null,"cs-bytes":1417,"x-bluecoat-application-name":"none","sc-status":200,"x-rs-ocsp-error":null,"cs(Accept-Language)":"en-US","sc-bytes":245,"x-bluecoat-application-operation":"none","date":[2018,2,2],"cs-method":"GET","c-connect-type":"Transparent","cs-ip":"196.168.1.1","cs(User-Agent)":"Mozilla/5.0 (Windows NT 10.0; Win64; x64) AppleWebKit/537.36 (KHTML, like Gecko) Chrome/51.0.2704.79 Safari/537.36 Edge/14.14393","cs-uri-query":"?a=MSGFETCHNEWMESSAGES&since=1517580570&_=1517580575569","cs-uri-scheme":"http","s-action":"TCP_NC_MISS","x-rs-certificate-observed-errors":null,"cs-uri-extension":"jsp","x-cs-ocsp-error":null,"s-supplier-ip":"196.168.1.1","x-rs-certificate-hostname-category":null,"cs-uri-port":80,"cs-threat-risk":"unavailable","x-bluecoat-reference-id":"WA-SP-A_Standard-Allow","s-supplier-name":"graf.bookoo.com","cs-categories":"Shopping","cs-username":null,"s-supplier-country":"None","s-supplier-failures":null,"cs-host":"graf.bookoo.com","s-ip":"196.168.1.1","c-ip":"196.168.1.1","x-rs-connection-negotiated-cipher-strength":"none","cs(Referer)":"http://graf.bookoo.com/cars-and-trucks/s/automatic/page9?price_max=7000"},{"rs(Content-Type)":"application/ocsp-response","x-rs-certificate-hostname-threat-risk":null,"cs-uri-extension":null,"cs(Accept-Language)":"en;q=0.5","cs-bytes":431,"sc-filter-result":"OBSERVED","x-rs-certificate-observed-errors":null,"s-supplier-failures":null,"sc-bytes":2109,"cs(User-Agent)":"Mozilla/5.0 (Windows NT 10.0; WOW64; rv:52.0) Gecko/20100101 Firefox/52.0","s-action":"TCP_NC_MISS","cs-threat-risk":"unavailable","s-ip":"196.168.1.1","sc-status":200,"x-exception-id":null,"cs-uri-query":null,"x-rs-certificate-hostname":null,"cs(Referer)":null,"c-connect-type":"Transparent","x-bluecoat-application-name":"none","time-taken":344.0,"cs-auth-group":null,"x-rs-certificate-hostname-category":null,"cs-ip":"196.168.1.1","c-ip":"196.168.1.1","x-rs-connection-negotiated-cipher-strength":"none","date":[2018,2,2],"cs-uri-port":80,"x-bluecoat-reference-id":"CPL-SP-A_Auth-BP-ACT","cs-uri-path":"/","cs-username":null,"x-cs-ocsp-error":null,"x-cs-connection-negotiated-ssl-version":null,"x-bluecoat-application-operation":"none","time":[22,19,11],"s-supplier-country":"None","x-virus-id":null,"cs-host":"s2.symcb.com","s-supplier-ip":"196.168.1.1","cs-uri-scheme":"http","cs-method":"POST","x-rs-ocsp-error":null,"cs-categories":"Non-Viewable/Infrastructure","x-cs-connection-negotiated-cipher-strength":"none","s-supplier-name":"s2.symcb.com"},{"x-rs-certificate-observed-errors":null,"x-rs-ocsp-error":null,"cs(User-Agent)":"Microsoft-CryptoAPI/10.0","s-supplier-failures":null,"x-bluecoat-application-operation":"none","s-supplier-country":"Unavailable","x-virus-id":null,"x-rs-certificate-hostname-category":null,"s-ip":"196.168.1.1","x-bluecoat-application-name":"none","time":[22,19,11],"cs-bytes":238,"cs-uri-scheme":"http","cs-threat-risk":"unavailable","x-cs-ocsp-error":null,"x-bluecoat-reference-id":"CPL-SP-A_Auth-BP-UA","cs-host":"crl.adobe.com","sc-filter-result":"OBSERVED","x-rs-certificate-hostname-threat-risk":null,"x-cs-connection-negotiated-ssl-version":null,"cs-uri-port":80,"cs-username":null,"x-exception-id":null,"x-rs-connection-negotiated-cipher-strength":"none","x-cs-connection-negotiated-cipher-strength":"none","cs-ip":"196.168.1.1","s-supplier-name":"196.168.1.1","cs-method":"GET","x-rs-certificate-hostname":null,"cs(Referer)":null,"cs-uri-extension":"crl","date":[2018,2,2],"s-action":"TCP_HIT","time-taken":1.0,"sc-status":304,"cs-auth-group":null,"cs-uri-query":null,"rs(Content-Type)":null,"cs-categories":"IA-Global-Permit;Technology/Internet;Non-Viewable/Infrastructure","s-supplier-ip":"196.168.1.1","c-ip":"196.168.1.1","sc-bytes":280,"cs(Accept-Language)":null,"cs-uri-path":"/cds.crl","c-connect-type":"Transparent"},{"cs-uri-query":null,"cs-threat-risk":"unavailable","x-cs-ocsp-error":null,"c-ip":"196.168.1.1","time-taken":108.0,"x-bluecoat-application-name":"none","cs(Accept-Language)":null,"cs-host":"mscrl.microsoft.com","cs-categories":"IA-Global-Permit;Non-Viewable/Infrastructure","date":[2018,2,2],"cs(User-Agent)":"Axway_Desktop_Validator/196.168.1.1.0","cs-bytes":212,"x-rs-ocsp-error":null,"cs-auth-group":null,"s-supplier-country":"Unavailable","x-rs-certificate-hostname":null,"rs(Content-Type)":"application/octet-stream","s-action":"TCP_HIT","s-supplier-failures":null,"cs-ip":"196.168.1.1","sc-status":200,"x-rs-certificate-hostname-threat-risk":null,"x-rs-certificate-observed-errors":null,"cs-uri-port":80,"sc-bytes":138991,"cs(Referer)":null,"s-supplier-ip":"196.168.1.1","x-rs-certificate-hostname-category":null,"cs-uri-scheme":"http","time":[22,19,11],"x-virus-id":null,"cs-method":"GET","x-bluecoat-reference-id":"CPL-SP-A_Auth-BP-D","x-exception-id":null,"c-connect-type":"Transparent","x-rs-connection-negotiated-cipher-strength":"none","x-bluecoat-application-operation":"none","x-cs-connection-negotiated-cipher-strength":"none","cs-uri-path":"/pki/mscorp/crl/Microsoft%20IT%20TLS%20CA%202.crl","s-ip":"196.168.1.1","cs-username":null,"sc-filter-result":"OBSERVED","s-supplier-name":"196.168.1.1","cs-uri-extension":"crl","x-cs-connection-negotiated-ssl-version":null},{"x-cs-connection-negotiated-ssl-version":null,"s-supplier-name":"sv.symcb.com","cs-categories":"Non-Viewable/Infrastructure","x-bluecoat-application-name":"none","cs-uri-port":80,"x-rs-certificate-hostname-category":null,"s-supplier-failures":null,"x-virus-id":null,"cs-uri-path":"/sv.crl","x-rs-connection-negotiated-cipher-strength":"none","cs-uri-extension":"crl","cs-bytes":113,"date":[2018,2,2],"s-action":"TCP_CLIENT_REFRESH","cs(User-Agent)":"Axway_Desktop_Validator/196.168.1.1.0","x-bluecoat-application-operation":"none","rs(Content-Type)":"application/pkix-crl","s-supplier-ip":"196.168.1.1","cs-username":null,"time-taken":161.0,"sc-filter-result":"OBSERVED","cs-method":"GET","x-bluecoat-reference-id":"WA-SP-A_Standard-Allow","cs-uri-query":null,"sc-status":200,"cs-host":"sv.symcb.com","x-rs-ocsp-error":null,"s-ip":"196.168.1.1","time":[22,19,12],"cs-ip":"196.168.1.1","s-supplier-country":"None","x-cs-connection-negotiated-cipher-strength":"none","cs-auth-group":null,"x-rs-certificate-observed-errors":null,"x-rs-certificate-hostname":null,"cs(Referer)":null,"sc-bytes":52884,"x-cs-ocsp-error":null,"cs(Accept-Language)":null,"c-connect-type":"Transparent","x-exception-id":null,"x-rs-certificate-hostname-threat-risk":null,"cs-uri-scheme":"http","c-ip":"196.168.1.1","cs-threat-risk":"unavailable"},{"cs-uri-scheme":"http","cs-uri-query":"?r=1517609951786","rs(Content-Type)":"text/xml","s-supplier-country":"None","x-rs-certificate-observed-errors":null,"s-action":"TCP_MISS","c-connect-type":"Transparent","x-rs-ocsp-error":null,"cs-uri-path":"/settings/17fc406c5357ba6e0a490d4d-adobeorg.xml","x-rs-connection-negotiated-cipher-strength":"none","x-virus-id":null,"x-bluecoat-reference-id":"CPL-SE-A_Referrer","s-supplier-name":"foxnews.hb.omtrdc.net","cs(Accept-Language)":"en-US","c-ip":"196.168.1.1","x-cs-connection-negotiated-cipher-strength":"none","s-ip":"196.168.1.1","x-bluecoat-application-operation":"none","sc-bytes":501,"cs-username":null,"sc-filter-result":"OBSERVED","x-cs-ocsp-error":null,"x-rs-certificate-hostname-threat-risk":null,"cs-categories":"Streaming_Video_Required_Analytics;Web Ads/Analytics","cs-bytes":444,"sc-status":200,"s-supplier-failures":null,"x-cs-connection-negotiated-ssl-version":null,"time-taken":244.0,"cs-ip":"196.168.1.1","cs-auth-group":null,"cs(Referer)":"http://video.foxnews.com/static/orion/html/video/iframe/tve.html?v=20180201213719","cs-uri-extension":"xml","cs-host":"foxnews.hb.omtrdc.net","cs-uri-port":80,"date":[2018,2,2],"x-rs-certificate-hostname-category":null,"s-supplier-ip":"196.168.1.1","cs-threat-risk":"unavailable","cs-method":"GET","x-bluecoat-application-name":"none","x-exception-id":null,"time":[22,19,12],"x-rs-certificate-hostname":null,"cs(User-Agent)":"Mozilla/5.0 (Windows NT 10.0; WOW64; Trident/7.0; rv:11.0) like Gecko"},{"x-cs-connection-negotiated-ssl-version":null,"x-bluecoat-reference-id":"CPL-SP-A_Auth-BP-UA","cs-host":"ctldl.windowsupdate.com","cs-uri-scheme":"http","rs(Content-Type)":"application/vnd.ms-cab-compressed","time":[22,19,12],"s-supplier-country":"None","cs-ip":"196.168.1.1","cs(Accept-Language)":null,"x-exception-id":null,"cs-username":null,"cs-threat-risk":"unavailable","s-ip":"196.168.1.1","cs-categories":"IA-Global-Permit;Non-Viewable/Infrastructure","sc-status":200,"x-bluecoat-application-name":"Microsoft Update","c-connect-type":"Transparent","s-supplier-name":"ctldl.windowsupdate.com","cs-uri-port":80,"s-supplier-failures":null,"sc-filter-result":"OBSERVED","date":[2018,2,2],"sc-bytes":8130,"cs-bytes":196,"x-rs-ocsp-error":null,"x-cs-ocsp-error":null,"cs(Referer)":null,"s-supplier-ip":"196.168.1.1","cs-auth-group":null,"cs-uri-path":"/msdownload/update/v3/static/trustedr/en/pinrulesstl.cab","time-taken":261.0,"x-cs-connection-negotiated-cipher-strength":"none","cs-method":"GET","x-rs-certificate-hostname-threat-risk":null,"s-action":"TCP_NC_MISS","x-virus-id":null,"c-ip":"196.168.1.1","cs(User-Agent)":"Microsoft-CryptoAPI/10.0","x-rs-certificate-hostname-category":null,"x-rs-certificate-hostname":null,"cs-uri-extension":"cab","x-rs-certificate-observed-errors":null,"x-bluecoat-application-operation":"Update Software","x-rs-connection-negotiated-cipher-strength":"none","cs-uri-query":"?e3886cb5c37a1fcc"},{"s-ip":"196.168.1.1","time":[22,19,12],"cs-categories":"IA-Global-Permit;Technology/Internet;Non-Viewable/Infrastructure","cs-uri-port":80,"sc-status":304,"x-bluecoat-application-operation":"none","cs-method":"GET","x-rs-certificate-hostname-category":null,"s-supplier-ip":"196.168.1.1","cs-host":"crl.adobe.com","cs-uri-path":"/prodSvce.crl","cs(User-Agent)":"Microsoft-CryptoAPI/10.0","x-rs-connection-negotiated-cipher-strength":"none","cs-username":null,"x-rs-certificate-observed-errors":null,"x-cs-connection-negotiated-cipher-strength":"none","rs(Content-Type)":null,"date":[2018,2,2],"cs(Referer)":null,"c-connect-type":"Transparent","s-supplier-name":"196.168.1.1","s-supplier-failures":null,"x-rs-certificate-hostname-threat-risk":null,"s-supplier-country":"Unavailable","x-bluecoat-application-name":"none","x-virus-id":null,"x-bluecoat-reference-id":"CPL-SP-A_Auth-BP-UA","x-cs-ocsp-error":null,"c-ip":"196.168.1.1","cs-uri-extension":"crl","cs-ip":"196.168.1.1","cs-bytes":244,"sc-filter-result":"OBSERVED","x-rs-certificate-hostname":null,"cs-uri-scheme":"http","cs(Accept-Language)":null,"time-taken":1.0,"cs-auth-group":null,"x-exception-id":null,"cs-threat-risk":"unavailable","x-cs-connection-negotiated-ssl-version":null,"x-rs-ocsp-error":null,"s-action":"TCP_HIT","sc-bytes":281,"cs-uri-query":null},{"cs-uri-extension":"crl","cs-uri-port":80,"cs-auth-group":null,"x-rs-connection-negotiated-cipher-strength":"none","cs-method":"GET","x-rs-ocsp-error":null,"x-bluecoat-reference-id":"WA-SP-A_Standard-Allow","c-connect-type":"Transparent","s-action":"TCP_CLIENT_REFRESH","s-supplier-name":"sw.symcb.com","x-cs-connection-negotiated-ssl-version":null,"date":[2018,2,2],"c-ip":"196.168.1.1","time-taken":120.0,"cs-uri-query":null,"x-cs-connection-negotiated-cipher-strength":"none","s-ip":"196.168.1.1","cs-ip":"196.168.1.1","time":[22,19,12],"x-cs-ocsp-error":null,"x-bluecoat-application-name":"none","cs-host":"sw.symcb.com","x-rs-certificate-hostname":null,"x-virus-id":null,"cs-uri-path":"/sw.crl","s-supplier-ip":"196.168.1.1","rs(Content-Type)":"application/pkix-crl","cs-threat-risk":"unavailable","x-exception-id":null,"cs(Referer)":null,"cs(User-Agent)":"Axway_Desktop_Validator/196.168.1.1.0","x-bluecoat-application-operation":"none","s-supplier-country":"None","x-rs-certificate-observed-errors":null,"cs-username":null,"cs-bytes":113,"s-supplier-failures":null,"sc-bytes":8949,"sc-filter-result":"OBSERVED","cs-uri-scheme":"http","x-rs-certificate-hostname-category":null,"cs-categories":"Non-Viewable/Infrastructure","sc-status":200,"cs(Accept-Language)":null,"x-rs-certificate-hostname-threat-risk":null},{"cs-method":"GET","x-rs-certificate-hostname":null,"x-cs-connection-negotiated-ssl-version":null,"cs-username":null,"s-ip":"196.168.1.1","cs-uri-extension":"crl","x-rs-certificate-observed-errors":null,"cs-uri-path":"/UTN-USERFirst-Object.crl","s-supplier-country":"None","s-action":"TCP_NC_MISS","cs(Accept-Language)":null,"rs(Content-Type)":"text/html","x-rs-certificate-hostname-category":null,"cs-host":"crl.usertrust.com","s-supplier-name":"crl.usertrust.com","x-rs-ocsp-error":null,"time":[22,19,12],"cs-bytes":136,"x-rs-connection-negotiated-cipher-strength":"none","date":[2018,2,2],"x-rs-certificate-hostname-threat-risk":null,"cs-categories":"Non-Viewable/Infrastructure","x-bluecoat-application-name":"none","cs-threat-risk":"unavailable","s-supplier-failures":null,"sc-bytes":15513,"x-virus-id":null,"cs-uri-port":80,"cs-uri-query":null,"x-cs-connection-negotiated-cipher-strength":"none","cs-uri-scheme":"http","sc-status":503,"c-ip":"196.168.1.1","sc-filter-result":"OBSERVED","x-bluecoat-reference-id":"WA-SP-A_Standard-Allow","cs-ip":"196.168.1.1","x-bluecoat-application-operation":"none","cs(User-Agent)":"Axway_Desktop_Validator/196.168.1.1.0","x-cs-ocsp-error":null,"x-exception-id":null,"cs(Referer)":null,"cs-auth-group":null,"s-supplier-ip":"196.168.1.1","c-connect-type":"Transparent","time-taken":84.0},{"x-exception-id":null,"s-supplier-country":"None","cs-uri-path":"/dl/release2/chrome_component/VCUauoj7Hfs_28.0.0.161/28.0.0.161_win64_PepperFlashPlayer.crx3","x-cs-ocsp-error":null,"x-bluecoat-application-name":"none","cs(User-Agent)":"Microsoft BITS/7.8","s-ip":"196.168.1.1","cs-uri-scheme":"http","x-bluecoat-application-operation":"none","time-taken":83.0,"x-bluecoat-reference-id":"CPL-SP-A_Auth-BP-UA","x-rs-certificate-hostname":null,"cs-method":"GET","cs-categories":"Search Engines/Portals","x-virus-id":null,"x-rs-certificate-hostname-threat-risk":null,"x-rs-connection-negotiated-cipher-strength":"none","sc-status":206,"rs(Content-Type)":"application/octet-stream","s-supplier-ip":"196.168.1.1","cs-username":null,"x-rs-certificate-observed-errors":null,"date":[2018,2,2],"cs-threat-risk":"unavailable","cs-uri-query":null,"x-rs-ocsp-error":null,"sc-bytes":19177,"x-cs-connection-negotiated-cipher-strength":"none","cs(Referer)":null,"s-supplier-failures":null,"x-cs-connection-negotiated-ssl-version":null,"cs(Accept-Language)":null,"time":[22,19,12],"s-supplier-name":"www.google.com","cs-auth-group":null,"cs-host":"www.google.com","cs-uri-extension":"crx3","c-connect-type":"Transparent","cs-ip":"196.168.1.1","x-rs-certificate-hostname-category":null,"c-ip":"196.168.1.1","sc-filter-result":"OBSERVED","cs-bytes":309,"cs-uri-port":80,"s-action":"TCP_NC_MISS"},{"x-rs-certificate-observed-errors":null,"time":[22,19,12],"cs-uri-path":"/mapi.jsp","s-supplier-ip":"196.168.1.1","s-supplier-failures":null,"x-rs-certificate-hostname":null,"sc-status":200,"x-bluecoat-application-operation":"none","rs(Content-Type)":"text/plain;charset=UTF-8","s-ip":"196.168.1.1","cs-method":"GET","x-cs-connection-negotiated-cipher-strength":"none","sc-filter-result":"OBSERVED","cs(Referer)":"http://graf.bookoo.com/cars-and-trucks/page17","cs-username":null,"cs-uri-extension":"jsp","cs-uri-query":"?a=MSGFETCHNEWMESSAGES&since=1517580583&_=1517580587947","date":[2018,2,2],"cs(User-Agent)":"Mozilla/5.0 (Windows NT 10.0; Win64; x64) AppleWebKit/537.36 (KHTML, like Gecko) Chrome/51.0.2704.79 Safari/537.36 Edge/14.14393","s-supplier-name":"graf.bookoo.com","x-virus-id":null,"x-cs-ocsp-error":null,"s-supplier-country":"None","cs-uri-port":80,"cs-host":"graf.bookoo.com","c-ip":"196.168.1.1","x-rs-certificate-hostname-threat-risk":null,"cs-categories":"Shopping","cs-ip":"196.168.1.1","cs-bytes":1364,"cs-auth-group":null,"cs-threat-risk":"unavailable","x-cs-connection-negotiated-ssl-version":null,"cs(Accept-Language)":"en-US","x-rs-connection-negotiated-cipher-strength":"none","cs-uri-scheme":"http","time-taken":196.0,"sc-bytes":245,"s-action":"TCP_NC_MISS","x-rs-certificate-hostname-category":null,"x-bluecoat-application-name":"none","x-rs-ocsp-error":null,"x-bluecoat-reference-id":"WA-SP-A_Standard-Allow","x-exception-id":null,"c-connect-type":"Transparent"},{"x-bluecoat-application-operation":"none","sc-bytes":4902,"cs-threat-risk":"unavailable","cs-method":"GET","x-rs-certificate-hostname":null,"x-virus-id":null,"sc-filter-result":"DENIED","cs-bytes":427,"x-cs-connection-negotiated-cipher-strength":"none","c-ip":"196.168.1.1","cs-host":"espn.hb.omtrdc.net","s-supplier-name":null,"cs-uri-query":"?r=1517609952507","date":[2018,2,2],"time-taken":2.0,"x-bluecoat-application-name":"none","cs-uri-scheme":"http","cs-ip":"196.168.1.1","x-rs-ocsp-error":null,"s-supplier-failures":null,"s-supplier-country":"None","s-supplier-ip":null,"x-cs-ocsp-error":null,"x-rs-certificate-hostname-category":null,"x-rs-certificate-observed-errors":null,"cs-uri-path":"/settings/ee0201ac512d2be80a490d4c-adobeorg.xml","cs-username":null,"sc-status":401,"x-cs-connection-negotiated-ssl-version":null,"rs(Content-Type)":null,"x-exception-id":"usareur.content_filter_denied","s-ip":"196.168.1.1","cs(Referer)":"http://www.espn.com/nfl/story/_/id/22280667/kirk-cousins-free-world-watching-nfl","cs(Accept-Language)":"en-US","c-connect-type":"Transparent","cs-uri-extension":"xml","x-rs-certificate-hostname-threat-risk":null,"cs-uri-port":80,"time":[22,19,12],"s-action":"TCP_DENIED","x-rs-connection-negotiated-cipher-strength":"none","x-bluecoat-reference-id":"WA-LS-D_Standard-Deny","cs-categories":"Streaming_Video_Required_Analytics;Web Ads/Analytics","cs-auth-group":null,"cs(User-Agent)":"Mozilla/5.0 (Windows NT 10.0; WOW64; Trident/7.0; rv:11.0) like Gecko"},{"cs-host":"www.ebaumsworld.com","x-rs-certificate-hostname":null,"s-action":"TCP_NC_MISS","cs(User-Agent)":"Mozilla/5.0 (Windows NT 10.0; WOW64; rv:52.0) Gecko/20100101 Firefox/52.0","x-rs-certificate-hostname-category":null,"x-bluecoat-application-name":"eBaums World","s-ip":"196.168.1.1","sc-filter-result":"OBSERVED","x-cs-ocsp-error":null,"s-supplier-failures":null,"x-rs-certificate-hostname-threat-risk":null,"x-virus-id":null,"x-bluecoat-reference-id":"WA-SP-A_Standard-Allow","sc-status":200,"cs-auth-group":null,"cs-ip":"196.168.1.1","s-supplier-country":"None","cs(Accept-Language)":"en;q=0.5","x-rs-certificate-observed-errors":null,"c-connect-type":"Transparent","date":[2018,2,2],"rs(Content-Type)":"application/json","x-cs-connection-negotiated-cipher-strength":"none","x-bluecoat-application-operation":null,"sc-bytes":422,"cs-uri-port":80,"x-rs-connection-negotiated-cipher-strength":"none","cs-uri-query":null,"cs(Referer)":"http://www.ebaumsworld.com/","cs-uri-path":"/media/checknewfeature/","cs-categories":"Mixed Content/Potentially Adult;Humor/Jokes;Audio/Video Clips","x-cs-connection-negotiated-ssl-version":null,"s-supplier-ip":"196.168.1.1","cs-uri-scheme":"http","c-ip":"196.168.1.1","time":[22,19,12],"cs-method":"GET","x-exception-id":null,"cs-threat-risk":"unavailable","time-taken":387.0,"cs-uri-extension":null,"cs-bytes":909,"x-rs-ocsp-error":null,"s-supplier-name":"www.ebaumsworld.com","cs-username":null},{"x-bluecoat-application-name":"none","x-exception-id":null,"cs-ip":"196.168.1.1","cs-method":"GET","x-rs-certificate-hostname":null,"sc-filter-result":"OBSERVED","date":[2018,2,2],"cs-uri-path":"/1rewlive5skydrive/ODSUProduction","c-ip":"196.168.1.1","x-rs-ocsp-error":null,"s-supplier-ip":"196.168.1.1","time":[22,19,12],"cs-username":null,"s-supplier-name":"g.live.com","x-rs-certificate-hostname-threat-risk":null,"s-supplier-failures":null,"x-bluecoat-reference-id":"WA-SP-A_Standard-Allow","x-cs-connection-negotiated-cipher-strength":"none","cs(Accept-Language)":null,"x-cs-ocsp-error":null,"s-action":"TCP_NC_MISS","cs(User-Agent)":"Mozilla/4.0 (compatible; MSIE 7.0; Windows NT 10.0; WOW64; Trident/7.0; .NET4.0C; .NET4.0E; .NET CLR 2.0.50727; .NET CLR 3.0.30729; .NET CLR 3.5.30729; Tablet PC 2.0)","rs(Content-Type)":null,"cs-uri-port":80,"s-supplier-country":"None","x-rs-connection-negotiated-cipher-strength":"none","cs-uri-scheme":"http","x-rs-certificate-hostname-category":null,"cs-host":"g.live.com","cs-categories":"Search Engines/Portals","cs(Referer)":null,"cs-uri-extension":null,"x-cs-connection-negotiated-ssl-version":null,"cs-bytes":370,"x-rs-certificate-observed-errors":null,"time-taken":129.0,"cs-auth-group":null,"x-bluecoat-application-operation":"none","s-ip":"196.168.1.1","cs-uri-query":null,"x-virus-id":null,"sc-status":302,"cs-threat-risk":"unavailable","sc-bytes":335,"c-connect-type":"Transparent"},{"s-action":"TCP_NC_MISS","cs-uri-extension":null,"s-ip":"196.168.1.1","c-connect-type":"Transparent","x-bluecoat-application-operation":"none","s-supplier-failures":null,"x-cs-connection-negotiated-cipher-strength":"none","c-ip":"196.168.1.1","date":[2018,2,2],"s-supplier-ip":"196.168.1.1","cs-categories":"Streaming_Video_Required_Analytics;Web Ads/Analytics","cs-uri-query":"?ci=us-801796&c6=vc,c01&cc=1&tl=dav0-FOX%20News%20Channel&cg=Live&rnd=1517609952539","cs(Accept-Language)":"en-US","cs-ip":"196.168.1.1","cs-bytes":542,"x-rs-certificate-observed-errors":null,"s-supplier-country":"None","cs-method":"GET","x-bluecoat-reference-id":"CPL-SE-A_Referrer","x-cs-ocsp-error":null,"x-rs-certificate-hostname-category":null,"sc-bytes":379,"rs(Content-Type)":"image/gif","x-exception-id":null,"cs-host":"secure-us.imrworldwide.com","cs(Referer)":"http://video.foxnews.com/static/orion/html/video/iframe/tve.html?v=20180201213719","cs(User-Agent)":"Mozilla/5.0 (Windows NT 10.0; Win64; x64; Trident/7.0; rv:11.0) like Gecko","x-virus-id":null,"x-rs-connection-negotiated-cipher-strength":"none","cs-auth-group":null,"cs-uri-port":80,"sc-status":200,"cs-uri-scheme":"http","cs-threat-risk":"unavailable","x-bluecoat-application-name":"none","x-rs-certificate-hostname":null,"x-rs-ocsp-error":null,"s-supplier-name":"secure-us.imrworldwide.com","sc-filter-result":"OBSERVED","x-rs-certificate-hostname-threat-risk":null,"cs-username":null,"cs-uri-path":"/cgi-bin/m","time-taken":104.0,"x-cs-connection-negotiated-ssl-version":null,"time":[22,19,12]},{"sc-bytes":49178,"cs-uri-path":"/dl/release2/chrome_component/VCUauoj7Hfs_28.0.0.161/28.0.0.161_win64_PepperFlashPlayer.crx3","s-action":"TCP_NC_MISS","s-supplier-failures":null,"c-ip":"196.168.1.1","sc-filter-result":"OBSERVED","cs-uri-extension":"crx3","cs-username":null,"x-cs-connection-negotiated-cipher-strength":"none","x-rs-certificate-hostname-threat-risk":null,"cs-uri-query":null,"sc-status":206,"rs(Content-Type)":"application/octet-stream","s-ip":"196.168.1.1","x-rs-connection-negotiated-cipher-strength":"none","x-rs-ocsp-error":null,"x-bluecoat-reference-id":"CPL-SP-A_Auth-BP-UA","x-rs-certificate-hostname-category":null,"s-supplier-country":"None","cs(User-Agent)":"Microsoft BITS/7.8","x-rs-certificate-observed-errors":null,"cs-bytes":311,"time-taken":195.0,"x-rs-certificate-hostname":null,"cs-categories":"Search Engines/Portals","c-connect-type":"Transparent","x-cs-connection-negotiated-ssl-version":null,"cs(Referer)":null,"cs-threat-risk":"unavailable","cs-auth-group":null,"cs(Accept-Language)":null,"s-supplier-name":"www.google.com","s-supplier-ip":"196.168.1.1","cs-uri-scheme":"http","x-bluecoat-application-name":"none","cs-uri-port":80,"x-virus-id":null,"x-exception-id":null,"x-cs-ocsp-error":null,"cs-method":"GET","cs-ip":"196.168.1.1","x-bluecoat-application-operation":"none","cs-host":"www.google.com","date":[2018,2,2],"time":[22,19,12]},{"c-ip":"196.168.1.1","cs-uri-scheme":"http","x-rs-certificate-hostname-category":null,"s-action":"TCP_REFRESH_MISS","s-supplier-country":"None","cs(Referer)":"http://global.fncstatic.com/static/v/all/html/markets/futures/frame.html","sc-bytes":598,"x-virus-id":null,"s-ip":"196.168.1.1","cs-threat-risk":"unavailable","date":[2018,2,2],"x-cs-connection-negotiated-ssl-version":null,"rs(Content-Type)":"application/javascript;charset=ISO-8859-1","time-taken":149.0,"x-bluecoat-application-name":"none","cs-uri-extension":"idms","s-supplier-ip":"196.168.1.1","x-cs-connection-negotiated-cipher-strength":"none","cs-bytes":383,"x-rs-certificate-observed-errors":null,"x-cs-ocsp-error":null,"x-bluecoat-application-operation":"none","cs-categories":"News/Media","cs-uri-query":null,"x-bluecoat-reference-id":"WA-SP-A_Standard-Allow","cs(User-Agent)":"Mozilla/5.0 (Windows NT 10.0; Win64; x64; Trident/7.0; rv:11.0) like Gecko","cs-username":null,"x-exception-id":null,"cs-method":"GET","sc-status":200,"s-supplier-failures":null,"x-rs-certificate-hostname":null,"x-rs-certificate-hostname-threat-risk":null,"cs-auth-group":null,"cs(Accept-Language)":"en-US","x-rs-connection-negotiated-cipher-strength":"none","cs-uri-port":80,"cs-ip":"196.168.1.1","cs-uri-path":"/indices/indices_futures.idms","cs-host":"idms.foxbusiness.com","sc-filter-result":"OBSERVED","s-supplier-name":"idms.foxbusiness.com","c-connect-type":"Transparent","time":[22,19,13],"x-rs-ocsp-error":null},{"cs-method":"GET","cs-uri-scheme":"http","x-rs-connection-negotiated-cipher-strength":"none","sc-status":503,"x-exception-id":null,"sc-bytes":15513,"time":[22,19,13],"x-rs-certificate-hostname-category":null,"x-cs-ocsp-error":null,"x-cs-connection-negotiated-cipher-strength":"none","cs(User-Agent)":"Microsoft-CryptoAPI/10.0","x-bluecoat-application-operation":"none","cs-auth-group":null,"cs-host":"crl.usertrust.com","s-supplier-name":"crl.usertrust.com","cs-ip":"196.168.1.1","cs-categories":"Non-Viewable/Infrastructure","date":[2018,2,2],"cs-uri-query":null,"x-rs-certificate-hostname-threat-risk":null,"s-supplier-failures":null,"cs-bytes":142,"cs(Referer)":null,"x-virus-id":null,"cs-threat-risk":"unavailable","cs-uri-port":80,"s-action":"TCP_NC_MISS","x-rs-ocsp-error":null,"cs-uri-extension":"crl","x-bluecoat-reference-id":"CPL-SP-A_Auth-BP-UA","c-connect-type":"Transparent","x-cs-connection-negotiated-ssl-version":null,"x-rs-certificate-hostname":null,"sc-filter-result":"OBSERVED","s-ip":"196.168.1.1","cs(Accept-Language)":null,"x-rs-certificate-observed-errors":null,"s-supplier-country":"None","c-ip":"196.168.1.1","cs-username":null,"s-supplier-ip":"196.168.1.1","time-taken":69.0,"x-bluecoat-application-name":"none","cs-uri-path":"/UTN-USERFirst-Object.crl","rs(Content-Type)":"text/html"},{"cs-host":"foxnews.hb.omtrdc.net","x-rs-ocsp-error":null,"x-bluecoat-application-name":"none","x-rs-certificate-hostname-category":null,"x-cs-connection-negotiated-cipher-strength":"none","x-bluecoat-application-operation":"none","c-ip":"196.168.1.1","s-supplier-name":"foxnews.hb.omtrdc.net","x-virus-id":null,"sc-filter-result":"OBSERVED","cs-bytes":1180,"cs(Accept-Language)":"en-US","date":[2018,2,2],"s-supplier-failures":null,"c-connect-type":"Transparent","time-taken":123.0,"x-rs-certificate-hostname":null,"x-bluecoat-reference-id":"CPL-SE-A_Referrer","cs(Referer)":"http://video.foxnews.com/static/orion/html/video/iframe/tve.html?v=20180201213719","rs(Content-Type)":null,"cs-categories":"Streaming_Video_Required_Analytics;Web Ads/Analytics","x-cs-ocsp-error":null,"s-action":"TCP_NC_MISS","sc-status":204,"cs-username":null,"x-rs-connection-negotiated-cipher-strength":"none","x-cs-connection-negotiated-ssl-version":null,"cs-method":"GET","sc-bytes":139,"cs-uri-path":"/","time":[22,19,13],"cs(User-Agent)":"Mozilla/5.0 (Windows NT 10.0; Win64; x64; Trident/7.0; rv:11.0) like Gecko","cs-uri-port":80,"x-rs-certificate-hostname-threat-risk":null,"x-exception-id":null,"cs-ip":"196.168.1.1","s-supplier-country":"None","x-rs-certificate-observed-errors":null,"cs-uri-scheme":"http","cs-threat-risk":"unavailable","s-ip":"196.168.1.1","s-supplier-ip":"196.168.1.1","cs-uri-query":"?s:sc:rsid=foxnews&s:sc:tracking_server=metrics.foxnews.com&h:sc:ssl=0&s:user:mid=23945224161468769353558450263201363044&s:aam:blob=RKhpRz8krg2tLO6pguXWp5olkAcUniQYPHaMWWgdJ3xzPWQmdj0y&l:aam:loc_hint=6&s:sp:ovp=Akamai%20AMP&s:sp:sdk=FOX%20News%20Player%20v7.90.9%3Ahtml&s:sp:channel=Fox%20News&s:sp:player_name=fullpage&s:sp:hb_version=js-196.168.1.1-55a81f&l:sp:hb_api_lvl=4&s:event:sid=1517609947479605658710&s:event:type=play&l:event:duration=5046&l:event:playhead=62352&l:event:ts=1517609952535&l:event:prev_ts=1517609947489&s:asset:type=main&s:asset:name=FOX%20News%20Channel&s:asset:video_id=1241186546001&s:asset:publisher=17FC406C5357BA6E0A490D4D%40AdobeOrg&l:asset:length=86400&s:stream:type=live&l:stream:bitrate=0&l:stream:fps=0&l:stream:dropped_frames=0&l:stream:startup_time=2","cs-uri-extension":null,"cs-auth-group":null},{"x-bluecoat-reference-id":"WA-SP-A_Standard-Allow","cs-auth-group":null,"cs-uri-query":null,"cs-uri-extension":"txt","cs-username":null,"x-rs-certificate-hostname-threat-risk":null,"date":[2018,2,2],"cs-bytes":293,"x-cs-connection-negotiated-ssl-version":null,"cs-categories":"Technology/Internet","cs(User-Agent)":"Mozilla/5.0 (Windows NT 10.0; WOW64; rv:52.0) Gecko/20100101 Firefox/52.0","c-ip":"196.168.1.1","s-supplier-name":"196.168.1.1","cs-method":"GET","s-ip":"196.168.1.1","cs(Accept-Language)":"en;q=0.5","x-bluecoat-application-operation":"none","rs(Content-Type)":null,"time-taken":57037.0,"x-rs-ocsp-error":null,"x-virus-id":null,"sc-status":503,"x-rs-connection-negotiated-cipher-strength":"none","cs(Referer)":null,"c-connect-type":"Transparent","cs-threat-risk":"unavailable","x-exception-id":"tcp_error","x-rs-certificate-hostname-category":null,"s-supplier-failures":null,"cs-host":"detectportal.firefox.com","x-cs-ocsp-error":null,"x-rs-certificate-hostname":null,"x-cs-connection-negotiated-cipher-strength":"none","x-bluecoat-application-name":"none","sc-bytes":1206,"cs-ip":"196.168.1.1","x-rs-certificate-observed-errors":null,"time":[22,21,27],"cs-uri-scheme":"http","s-supplier-ip":"196.168.1.1","cs-uri-path":"/success.txt","cs-uri-port":80,"s-supplier-country":"Unavailable","sc-filter-result":"DENIED","s-action":"TCP_ERR_MISS"},{"x-rs-certificate-observed-errors":null,"cs-uri-port":80,"sc-filter-result":"DENIED","cs(User-Agent)":"Mozilla/5.0 (Windows NT 10.0; WOW64; rv:52.0) Gecko/20100101 Firefox/52.0","c-ip":"196.168.1.1","x-rs-ocsp-error":null,"s-supplier-ip":"196.168.1.1","cs-ip":"196.168.1.1","s-ip":"196.168.1.1","x-cs-ocsp-error":null,"x-exception-id":"tcp_error","date":[2018,2,2],"x-virus-id":null,"cs-uri-path":"/success.txt","cs-threat-risk":"unavailable","c-connect-type":"Transparent","cs-username":null,"sc-status":503,"x-rs-certificate-hostname-category":null,"x-bluecoat-reference-id":"WA-SP-A_Standard-Allow","s-supplier-name":"196.168.1.1","cs-uri-scheme":"http","s-supplier-country":"Unavailable","x-rs-connection-negotiated-cipher-strength":"none","sc-bytes":1206,"cs-method":"GET","cs-bytes":293,"cs-auth-group":null,"cs-uri-extension":"txt","time-taken":60727.0,"cs-host":"detectportal.firefox.com","cs-categories":"Technology/Internet","x-rs-certificate-hostname-threat-risk":null,"time":[22,21,27],"x-cs-connection-negotiated-ssl-version":null,"x-cs-connection-negotiated-cipher-strength":"none","cs-uri-query":null,"cs(Referer)":null,"rs(Content-Type)":null,"x-rs-certificate-hostname":null,"s-action":"TCP_ERR_MISS","cs(Accept-Language)":"en;q=0.5","x-bluecoat-application-operation":"none","x-bluecoat-application-name":"none","s-supplier-failures":null},{"s-ip":"196.168.1.1","x-rs-ocsp-error":null,"rs(Content-Type)":null,"x-rs-certificate-hostname":null,"cs-bytes":293,"c-connect-type":"Transparent","cs-uri-extension":"txt","x-rs-connection-negotiated-cipher-strength":"none","x-rs-certificate-observed-errors":null,"x-virus-id":null,"x-bluecoat-reference-id":"WA-SP-A_Standard-Allow","time":[22,21,27],"cs(Accept-Language)":"en;q=0.5","x-cs-connection-negotiated-ssl-version":null,"time-taken":53776.0,"cs(User-Agent)":"Mozilla/5.0 (Windows NT 10.0; WOW64; rv:52.0) Gecko/20100101 Firefox/52.0","cs-uri-path":"/success.txt","cs-uri-port":80,"sc-bytes":1206,"x-exception-id":"tcp_error","cs-host":"detectportal.firefox.com","s-supplier-ip":"196.168.1.1","x-bluecoat-application-name":"none","x-bluecoat-application-operation":"none","x-rs-certificate-hostname-threat-risk":null,"cs-method":"GET","s-supplier-failures":null,"cs-uri-query":null,"s-supplier-country":"Unavailable","cs-categories":"Technology/Internet","cs-threat-risk":"unavailable","x-cs-ocsp-error":null,"x-cs-connection-negotiated-cipher-strength":"none","c-ip":"196.168.1.1","cs-uri-scheme":"http","cs-auth-group":null,"sc-filter-result":"DENIED","cs-ip":"196.168.1.1","x-rs-certificate-hostname-category":null,"date":[2018,2,2],"sc-status":503,"s-action":"TCP_ERR_MISS","s-supplier-name":"196.168.1.1","cs(Referer)":null,"cs-username":null},{"date":[2018,2,2],"c-ip":"196.168.1.1","x-rs-certificate-observed-errors":null,"cs-host":"detectportal.firefox.com","cs-categories":"Technology/Internet","time":[22,21,27],"x-bluecoat-application-operation":"none","s-supplier-country":"Unavailable","time-taken":60502.0,"s-ip":"196.168.1.1","x-rs-certificate-hostname":null,"x-bluecoat-reference-id":"WA-SP-A_Standard-Allow","cs-threat-risk":"unavailable","sc-filter-result":"DENIED","cs-uri-scheme":"http","cs(User-Agent)":"Mozilla/5.0 (Windows NT 10.0; WOW64; rv:52.0) Gecko/20100101 Firefox/52.0","x-rs-certificate-hostname-threat-risk":null,"x-rs-certificate-hostname-category":null,"s-supplier-ip":"196.168.1.1","cs(Accept-Language)":"en;q=0.5","x-cs-connection-negotiated-cipher-strength":"none","s-action":"TCP_ERR_MISS","x-bluecoat-application-name":"none","rs(Content-Type)":null,"cs-username":null,"c-connect-type":"Transparent","cs-uri-path":"/success.txt","cs(Referer)":null,"s-supplier-name":"196.168.1.1","cs-uri-port":80,"s-supplier-failures":null,"cs-auth-group":null,"cs-ip":"196.168.1.1","x-virus-id":null,"x-rs-ocsp-error":null,"x-exception-id":"tcp_error","x-rs-connection-negotiated-cipher-strength":"none","cs-uri-extension":"txt","x-cs-ocsp-error":null,"cs-bytes":293,"sc-status":503,"cs-method":"GET","x-cs-connection-negotiated-ssl-version":null,"sc-bytes":1206,"cs-uri-query":null},{"cs-uri-extension":"txt","s-action":"TCP_ERR_MISS","x-cs-connection-negotiated-ssl-version":null,"cs-username":null,"x-rs-certificate-observed-errors":null,"s-supplier-ip":"196.168.1.1","cs-host":"detectportal.firefox.com","x-bluecoat-application-name":"none","c-ip":"196.168.1.1","cs-method":"GET","date":[2018,2,2],"x-bluecoat-reference-id":"WA-SP-A_Standard-Allow","x-cs-ocsp-error":null,"cs-bytes":293,"s-supplier-failures":null,"cs-uri-query":null,"cs-ip":"196.168.1.1","time":[22,21,27],"cs(User-Agent)":"Mozilla/5.0 (Windows NT 10.0; WOW64; rv:52.0) Gecko/20100101 Firefox/52.0","x-rs-certificate-hostname-category":null,"s-supplier-country":"Unavailable","cs-uri-port":80,"s-supplier-name":"196.168.1.1","s-ip":"196.168.1.1","cs-auth-group":null,"x-rs-ocsp-error":null,"rs(Content-Type)":null,"x-exception-id":"tcp_error","cs-uri-scheme":"http","cs-uri-path":"/success.txt","cs-categories":"Technology/Internet","x-rs-certificate-hostname-threat-risk":null,"sc-bytes":1206,"x-rs-certificate-hostname":null,"x-cs-connection-negotiated-cipher-strength":"none","cs-threat-risk":"unavailable","sc-filter-result":"DENIED","sc-status":503,"cs(Accept-Language)":"en;q=0.5","c-connect-type":"Transparent","cs(Referer)":null,"x-virus-id":null,"x-rs-connection-negotiated-cipher-strength":"none","x-bluecoat-application-operation":"none","time-taken":47599.0},{"cs-method":"GET","sc-status":503,"cs-bytes":293,"s-ip":"196.168.1.1","c-ip":"196.168.1.1","x-bluecoat-application-name":"none","x-cs-connection-negotiated-cipher-strength":"none","rs(Content-Type)":null,"cs-categories":"Technology/Internet","x-rs-ocsp-error":null,"x-exception-id":"tcp_error","c-connect-type":"Transparent","cs-username":null,"cs-threat-risk":"unavailable","s-supplier-name":"196.168.1.1","x-cs-ocsp-error":null,"x-bluecoat-application-operation":"none","s-supplier-ip":"196.168.1.1","x-cs-connection-negotiated-ssl-version":null,"date":[2018,2,2],"cs(User-Agent)":"Mozilla/5.0 (Windows NT 10.0; WOW64; rv:52.0) Gecko/20100101 Firefox/52.0","sc-filter-result":"DENIED","s-supplier-country":"Unavailable","cs(Referer)":null,"x-virus-id":null,"time":[22,21,27],"x-rs-certificate-hostname":null,"cs-ip":"196.168.1.1","x-rs-certificate-hostname-threat-risk":null,"cs(Accept-Language)":"en;q=0.5","cs-uri-scheme":"http","cs-uri-extension":"txt","cs-auth-group":null,"x-rs-certificate-observed-errors":null,"x-rs-certificate-hostname-category":null,"cs-uri-port":80,"x-bluecoat-reference-id":"WA-SP-A_Standard-Allow","time-taken":65759.0,"s-supplier-failures":null,"cs-uri-query":null,"s-action":"TCP_ERR_MISS","cs-uri-path":"/success.txt","sc-bytes":1206,"cs-host":"detectportal.firefox.com","x-rs-connection-negotiated-cipher-strength":"none"},{"cs(User-Agent)":"Mozilla/5.0 (Windows NT 10.0; WOW64; rv:52.0) Gecko/20100101 Firefox/52.0","x-rs-ocsp-error":null,"cs-categories":"Technology/Internet","x-cs-connection-negotiated-ssl-version":null,"s-supplier-name":"196.168.1.1","cs(Referer)":null,"s-action":"TCP_ERR_MISS","cs-threat-risk":"unavailable","cs-username":null,"c-ip":"196.168.1.1","cs-ip":"196.168.1.1","c-connect-type":"Transparent","cs-uri-port":80,"s-supplier-failures":null,"date":[2018,2,2],"cs(Accept-Language)":"en;q=0.5","time":[22,21,27],"cs-method":"GET","x-bluecoat-application-name":"none","sc-status":503,"cs-uri-query":null,"x-virus-id":null,"x-rs-certificate-hostname":null,"x-bluecoat-application-operation":"none","rs(Content-Type)":null,"x-cs-ocsp-error":null,"s-supplier-ip":"196.168.1.1","time-taken":94786.0,"x-rs-connection-negotiated-cipher-strength":"none","sc-bytes":1206,"x-cs-connection-negotiated-cipher-strength":"none","s-ip":"196.168.1.1","s-supplier-country":"Unavailable","cs-uri-scheme":"http","cs-host":"detectportal.firefox.com","cs-bytes":293,"cs-uri-extension":"txt","x-rs-certificate-observed-errors":null,"sc-filter-result":"DENIED","x-rs-certificate-hostname-threat-risk":null,"x-rs-certificate-hostname-category":null,"x-exception-id":"tcp_error","cs-auth-group":null,"x-bluecoat-reference-id":"WA-SP-A_Standard-Allow","cs-uri-path":"/success.txt"},{"cs-uri-scheme":"http","cs(User-Agent)":"Mozilla/5.0 (Windows NT 10.0; WOW64; rv:52.0) Gecko/20100101 Firefox/52.0","cs-uri-port":80,"cs-uri-query":null,"cs-auth-group":null,"cs-host":"detectportal.firefox.com","x-exception-id":"tcp_error","c-ip":"196.168.1.1","cs-threat-risk":"unavailable","rs(Content-Type)":null,"x-rs-certificate-hostname-category":null,"cs(Referer)":null,"cs-categories":"Technology/Internet","cs-username":null,"x-rs-ocsp-error":null,"time":[22,21,27],"x-cs-connection-negotiated-ssl-version":null,"cs-ip":"196.168.1.1","sc-bytes":1206,"x-rs-connection-negotiated-cipher-strength":"none","s-supplier-name":"196.168.1.1","cs(Accept-Language)":"en;q=0.5","cs-uri-path":"/success.txt","x-bluecoat-application-name":"none","x-bluecoat-application-operation":"none","cs-uri-extension":"txt","x-rs-certificate-hostname":null,"x-cs-connection-negotiated-cipher-strength":"none","s-ip":"196.168.1.1","s-supplier-ip":"196.168.1.1","s-action":"TCP_ERR_MISS","x-rs-certificate-observed-errors":null,"x-virus-id":null,"time-taken":28385.0,"s-supplier-country":"Unavailable","x-cs-ocsp-error":null,"date":[2018,2,2],"cs-bytes":293,"cs-method":"GET","sc-status":503,"x-rs-certificate-hostname-threat-risk":null,"x-bluecoat-reference-id":"WA-SP-A_Standard-Allow","c-connect-type":"Transparent","s-supplier-failures":null,"sc-filter-result":"DENIED"}],"input":"#Software: SGOS 196.168.1.1\r\n#Version: 1.0\r\n#Start-Date: 2018-02-02 22:19:11\r\n#Date: 2017-08-16 07:41:53\r\n#Fields: date time time-taken c-ip cs-username cs-auth-group s-supplier-name s-supplier-ip s-supplier-country s-supplier-failures x-exception-id sc-filter-result cs-categories cs(Referer) sc-status s-action cs-method rs(Content-Type) cs-uri-scheme cs-host cs-uri-port cs-uri-path cs-uri-query cs-uri-extension cs(User-Agent) s-ip sc-bytes cs-bytes x-virus-id x-bluecoat-application-name x-bluecoat-application-operation x-rs-certificate-observed-errors x-cs-ocsp-error x-rs-ocsp-error x-rs-connection-negotiated-cipher-strength x-rs-certificate-hostname x-rs-certificate-hostname-category cs-threat-risk x-rs-certificate-hostname-threat-risk c-connect-type x-bluecoat-reference-id cs-ip x-cs-connection-negotiated-cipher-strength x-cs-connection-negotiated-ssl-version cs(Accept-Language)\r\n#Remark: 1315300034 \"bc-wcf-b1-site-1\" \"196.168.1.1\" \"CND-HTTP-tenant\"\r\n2018-02-02 22:19:11 70 196.168.1.1 - - crl.usertrust.com 196.168.1.1 None - - OBSERVED \"Non-Viewable/Infrastructure\" - 503 TCP_NC_MISS GET text/html http crl.usertrust.com 80 /UTN-USERFirst-Object.crl - crl \"Microsoft-CryptoAPI/10.0\" 196.168.1.1 15513 223 - \"none\" \"none\" - - - none - - unavailable - Transparent \"CPL-SP-A_Auth-BP-UA\" 196.168.1.1 none - -\r\n2018-02-02 22:19:11 182 196.168.1.1 - - www.google.com 196.168.1.1 None - - OBSERVED \"Search Engines/Portals\" - 206 TCP_NC_MISS GET application/octet-stream http www.google.com 80 /dl/release2/chrome_component/VCUauoj7Hfs_28.0.0.161/28.0.0.161_win64_PepperFlashPlayer.crx3 - crx3 \"Microsoft BITS/7.8\" 196.168.1.1 38992 311 - \"none\" \"none\" - - - none - - unavailable - Transparent \"CPL-SP-A_Auth-BP-UA\" 196.168.1.1 none - -\r\n2018-02-02 22:19:11 89 196.168.1.1 - - redirector.gvt1.com 196.168.1.1 None - - OBSERVED \"Content Servers\" - 503 TCP_NC_MISS GET text/html http redirector.gvt1.com 80 /edgedl/chromewebstore/L2Nocm9tZV9leHRlbnNpb24vYmxvYnMvNjBjQUFWZ1QtVG9Nc3VfVEtEYmd4aG5tZw/6417.1211.0.0_pkedcjkdefgpdelpbcmbmeomcjbeemfm.crx - crx \"Mozilla/5.0 (Windows NT 10.0; Win64; x64) AppleWebKit/537.36 (KHTML, like Gecko) Chrome/64.0.3282.119 Safari/537.36\" 196.168.1.1 15747 402 - \"none\" \"none\" - - - none - - unavailable - Transparent \"WA-SP-A_Standard-Allow\" 196.168.1.1 none - \"en;q=0.9\"\r\n2018-02-02 22:19:11 194 196.168.1.1 - - graf.bookoo.com 196.168.1.1 None - - OBSERVED \"Shopping\" http://graf.bookoo.com/cars-and-trucks/s/automatic/page9?price_max=7000 200 TCP_NC_MISS GET text/plain;charset=UTF-8 http graf.bookoo.com 80 /mapi.jsp ?a=MSGFETCHNEWMESSAGES&since=1517580570&_=1517580575569 jsp \"Mozilla/5.0 (Windows NT 10.0; Win64; x64) AppleWebKit/537.36 (KHTML, like Gecko) Chrome/51.0.2704.79 Safari/537.36 Edge/14.14393\" 196.168.1.1 245 1417 - \"none\" \"none\" - - - none - - unavailable - Transparent \"WA-SP-A_Standard-Allow\" 196.168.1.1 none - \"en-US\"\r\n2018-02-02 22:19:11 344 196.168.1.1 - - s2.symcb.com 196.168.1.1 None - - OBSERVED \"Non-Viewable/Infrastructure\" - 200 TCP_NC_MISS POST application/ocsp-response http s2.symcb.com 80 / - - \"Mozilla/5.0 (Windows NT 10.0; WOW64; rv:52.0) Gecko/20100101 Firefox/52.0\" 196.168.1.1 2109 431 - \"none\" \"none\" - - - none - - unavailable - Transparent \"CPL-SP-A_Auth-BP-ACT\" 196.168.1.1 none - \"en;q=0.5\"\r\n2018-02-02 22:19:11 1 196.168.1.1 - - 196.168.1.1 196.168.1.1 Unavailable - - OBSERVED \"IA-Global-Permit;Technology/Internet;Non-Viewable/Infrastructure\" - 304 TCP_HIT GET - http crl.adobe.com 80 /cds.crl - crl \"Microsoft-CryptoAPI/10.0\" 196.168.1.1 280 238 - \"none\" \"none\" - - - none - - unavailable - Transparent \"CPL-SP-A_Auth-BP-UA\" 196.168.1.1 none - -\r\n2018-02-02 22:19:11 108 196.168.1.1 - - 196.168.1.1 196.168.1.1 Unavailable - - OBSERVED \"IA-Global-Permit;Non-Viewable/Infrastructure\" - 200 TCP_HIT GET application/octet-stream http mscrl.microsoft.com 80 /pki/mscorp/crl/Microsoft%20IT%20TLS%20CA%202.crl - crl \"Axway_Desktop_Validator/196.168.1.1.0\" 196.168.1.1 138991 212 - \"none\" \"none\" - - - none - - unavailable - Transparent \"CPL-SP-A_Auth-BP-D\" 196.168.1.1 none - -\r\n2018-02-02 22:19:12 161 196.168.1.1 - - sv.symcb.com 196.168.1.1 None - - OBSERVED \"Non-Viewable/Infrastructure\" - 200 TCP_CLIENT_REFRESH GET application/pkix-crl http sv.symcb.com 80 /sv.crl - crl \"Axway_Desktop_Validator/196.168.1.1.0\" 196.168.1.1 52884 113 - \"none\" \"none\" - - - none - - unavailable - Transparent \"WA-SP-A_Standard-Allow\" 196.168.1.1 none - -\r\n2018-02-02 22:19:12 244 196.168.1.1 - - foxnews.hb.omtrdc.net 196.168.1.1 None - - OBSERVED \"Streaming_Video_Required_Analytics;Web Ads/Analytics\" http://video.foxnews.com/static/orion/html/video/iframe/tve.html?v=20180201213719 200 TCP_MISS GET text/xml http foxnews.hb.omtrdc.net 80 /settings/17fc406c5357ba6e0a490d4d-adobeorg.xml ?r=1517609951786 xml \"Mozilla/5.0 (Windows NT 10.0; WOW64; Trident/7.0; rv:11.0) like Gecko\" 196.168.1.1 501 444 - \"none\" \"none\" - - - none - - unavailable - Transparent \"CPL-SE-A_Referrer\" 196.168.1.1 none - \"en-US\"\r\n2018-02-02 22:19:12 261 196.168.1.1 - - ctldl.windowsupdate.com 196.168.1.1 None - - OBSERVED \"IA-Global-Permit;Non-Viewable/Infrastructure\" - 200 TCP_NC_MISS GET application/vnd.ms-cab-compressed http ctldl.windowsupdate.com 80 /msdownload/update/v3/static/trustedr/en/pinrulesstl.cab ?e3886cb5c37a1fcc cab \"Microsoft-CryptoAPI/10.0\" 196.168.1.1 8130 196 - \"Microsoft Update\" \"Update Software\" - - - none - - unavailable - Transparent \"CPL-SP-A_Auth-BP-UA\" 196.168.1.1 none - -\r\n2018-02-02 22:19:12 1 196.168.1.1 - - 196.168.1.1 196.168.1.1 Unavailable - - OBSERVED \"IA-Global-Permit;Technology/Internet;Non-Viewable/Infrastructure\" - 304 TCP_HIT GET - http crl.adobe.com 80 /prodSvce.crl - crl \"Microsoft-CryptoAPI/10.0\" 196.168.1.1 281 244 - \"none\" \"none\" - - - none - - unavailable - Transparent \"CPL-SP-A_Auth-BP-UA\" 196.168.1.1 none - -\r\n2018-02-02 22:19:12 120 196.168.1.1 - - sw.symcb.com 196.168.1.1 None - - OBSERVED \"Non-Viewable/Infrastructure\" - 200 TCP_CLIENT_REFRESH GET application/pkix-crl http sw.symcb.com 80 /sw.crl - crl \"Axway_Desktop_Validator/196.168.1.1.0\" 196.168.1.1 8949 113 - \"none\" \"none\" - - - none - - unavailable - Transparent \"WA-SP-A_Standard-Allow\" 196.168.1.1 none - -\r\n2018-02-02 22:19:12 84 196.168.1.1 - - crl.usertrust.com 196.168.1.1 None - - OBSERVED \"Non-Viewable/Infrastructure\" - 503 TCP_NC_MISS GET text/html http crl.usertrust.com 80 /UTN-USERFirst-Object.crl - crl \"Axway_Desktop_Validator/196.168.1.1.0\" 196.168.1.1 15513 136 - \"none\" \"none\" - - - none - - unavailable - Transparent \"WA-SP-A_Standard-Allow\" 196.168.1.1 none - -\r\n2018-02-02 22:19:12 83 196.168.1.1 - - www.google.com 196.168.1.1 None - - OBSERVED \"Search Engines/Portals\" - 206 TCP_NC_MISS GET application/octet-stream http www.google.com 80 /dl/release2/chrome_component/VCUauoj7Hfs_28.0.0.161/28.0.0.161_win64_PepperFlashPlayer.crx3 - crx3 \"Microsoft BITS/7.8\" 196.168.1.1 19177 309 - \"none\" \"none\" - - - none - - unavailable - Transparent \"CPL-SP-A_Auth-BP-UA\" 196.168.1.1 none - -\r\n2018-02-02 22:19:12 196 196.168.1.1 - - graf.bookoo.com 196.168.1.1 None - - OBSERVED \"Shopping\" http://graf.bookoo.com/cars-and-trucks/page17 200 TCP_NC_MISS GET text/plain;charset=UTF-8 http graf.bookoo.com 80 /mapi.jsp ?a=MSGFETCHNEWMESSAGES&since=1517580583&_=1517580587947 jsp \"Mozilla/5.0 (Windows NT 10.0; Win64; x64) AppleWebKit/537.36 (KHTML, like Gecko) Chrome/51.0.2704.79 Safari/537.36 Edge/14.14393\" 196.168.1.1 245 1364 - \"none\" \"none\" - - - none - - unavailable - Transparent \"WA-SP-A_Standard-Allow\" 196.168.1.1 none - \"en-US\"\r\n2018-02-02 22:19:12 2 196.168.1.1 - - - - None - usareur.content_filter_denied DENIED \"Streaming_Video_Required_Analytics;Web Ads/Analytics\" http://www.espn.com/nfl/story/_/id/22280667/kirk-cousins-free-world-watching-nfl 401 TCP_DENIED GET - http espn.hb.omtrdc.net 80 /settings/ee0201ac512d2be80a490d4c-adobeorg.xml ?r=1517609952507 xml \"Mozilla/5.0 (Windows NT 10.0; WOW64; Trident/7.0; rv:11.0) like Gecko\" 196.168.1.1 4902 427 - \"none\" \"none\" - - - none - - unavailable - Transparent \"WA-LS-D_Standard-Deny\" 196.168.1.1 none - \"en-US\"\r\n2018-02-02 22:19:12 387 196.168.1.1 - - www.ebaumsworld.com 196.168.1.1 None - - OBSERVED \"Mixed Content/Potentially Adult;Humor/Jokes;Audio/Video Clips\" http://www.ebaumsworld.com/ 200 TCP_NC_MISS GET application/json http www.ebaumsworld.com 80 /media/checknewfeature/ - - \"Mozilla/5.0 (Windows NT 10.0; WOW64; rv:52.0) Gecko/20100101 Firefox/52.0\" 196.168.1.1 422 909 - \"eBaums World\" - - - - none - - unavailable - Transparent \"WA-SP-A_Standard-Allow\" 196.168.1.1 none - \"en;q=0.5\"\r\n2018-02-02 22:19:12 129 196.168.1.1 - - g.live.com 196.168.1.1 None - - OBSERVED \"Search Engines/Portals\" - 302 TCP_NC_MISS GET - http g.live.com 80 /1rewlive5skydrive/ODSUProduction - - \"Mozilla/4.0 (compatible; MSIE 7.0; Windows NT 10.0; WOW64; Trident/7.0; .NET4.0C; .NET4.0E; .NET CLR 2.0.50727; .NET CLR 3.0.30729; .NET CLR 3.5.30729; Tablet PC 2.0)\" 196.168.1.1 335 370 - \"none\" \"none\" - - - none - - unavailable - Transparent \"WA-SP-A_Standard-Allow\" 196.168.1.1 none - -\r\n2018-02-02 22:19:12 104 196.168.1.1 - - secure-us.imrworldwide.com 196.168.1.1 None - - OBSERVED \"Streaming_Video_Required_Analytics;Web Ads/Analytics\" http://video.foxnews.com/static/orion/html/video/iframe/tve.html?v=20180201213719 200 TCP_NC_MISS GET image/gif http secure-us.imrworldwide.com 80 /cgi-bin/m ?ci=us-801796&c6=vc,c01&cc=1&tl=dav0-FOX%20News%20Channel&cg=Live&rnd=1517609952539 - \"Mozilla/5.0 (Windows NT 10.0; Win64; x64; Trident/7.0; rv:11.0) like Gecko\" 196.168.1.1 379 542 - \"none\" \"none\" - - - none - - unavailable - Transparent \"CPL-SE-A_Referrer\" 196.168.1.1 none - \"en-US\"\r\n2018-02-02 22:19:12 195 196.168.1.1 - - www.google.com 196.168.1.1 None - - OBSERVED \"Search Engines/Portals\" - 206 TCP_NC_MISS GET application/octet-stream http www.google.com 80 /dl/release2/chrome_component/VCUauoj7Hfs_28.0.0.161/28.0.0.161_win64_PepperFlashPlayer.crx3 - crx3 \"Microsoft BITS/7.8\" 196.168.1.1 49178 311 - \"none\" \"none\" - - - none - - unavailable - Transparent \"CPL-SP-A_Auth-BP-UA\" 196.168.1.1 none - -\r\n2018-02-02 22:19:13 149 196.168.1.1 - - idms.foxbusiness.com 196.168.1.1 None - - OBSERVED \"News/Media\" http://global.fncstatic.com/static/v/all/html/markets/futures/frame.html 200 TCP_REFRESH_MISS GET application/javascript;charset=ISO-8859-1 http idms.foxbusiness.com 80 /indices/indices_futures.idms - idms \"Mozilla/5.0 (Windows NT 10.0; Win64; x64; Trident/7.0; rv:11.0) like Gecko\" 196.168.1.1 598 383 - \"none\" \"none\" - - - none - - unavailable - Transparent \"WA-SP-A_Standard-Allow\" 196.168.1.1 none - \"en-US\"\r\n2018-02-02 22:19:13 69 196.168.1.1 - - crl.usertrust.com 196.168.1.1 None - - OBSERVED \"Non-Viewable/Infrastructure\" - 503 TCP_NC_MISS GET text/html http crl.usertrust.com 80 /UTN-USERFirst-Object.crl - crl \"Microsoft-CryptoAPI/10.0\" 196.168.1.1 15513 142 - \"none\" \"none\" - - - none - - unavailable - Transparent \"CPL-SP-A_Auth-BP-UA\" 196.168.1.1 none - -\r\n2018-02-02 22:19:13 123 196.168.1.1 - - foxnews.hb.omtrdc.net 196.168.1.1 None - - OBSERVED \"Streaming_Video_Required_Analytics;Web Ads/Analytics\" http://video.foxnews.com/static/orion/html/video/iframe/tve.html?v=20180201213719 204 TCP_NC_MISS GET - http foxnews.hb.omtrdc.net 80 / ?s:sc:rsid=foxnews&s:sc:tracking_server=metrics.foxnews.com&h:sc:ssl=0&s:user:mid=23945224161468769353558450263201363044&s:aam:blob=RKhpRz8krg2tLO6pguXWp5olkAcUniQYPHaMWWgdJ3xzPWQmdj0y&l:aam:loc_hint=6&s:sp:ovp=Akamai%20AMP&s:sp:sdk=FOX%20News%20Player%20v7.90.9%3Ahtml&s:sp:channel=Fox%20News&s:sp:player_name=fullpage&s:sp:hb_version=js-196.168.1.1-55a81f&l:sp:hb_api_lvl=4&s:event:sid=1517609947479605658710&s:event:type=play&l:event:duration=5046&l:event:playhead=62352&l:event:ts=1517609952535&l:event:prev_ts=1517609947489&s:asset:type=main&s:asset:name=FOX%20News%20Channel&s:asset:video_id=1241186546001&s:asset:publisher=17FC406C5357BA6E0A490D4D%40AdobeOrg&l:asset:length=86400&s:stream:type=live&l:stream:bitrate=0&l:stream:fps=0&l:stream:dropped_frames=0&l:stream:startup_time=2 - \"Mozilla/5.0 (Windows NT 10.0; Win64; x64; Trident/7.0; rv:11.0) like Gecko\" 196.168.1.1 139 1180 - \"none\" \"none\" - - - none - - unavailable - Transparent \"CPL-SE-A_Referrer\" 196.168.1.1 none - \"en-US\"\r\n2018-02-02 22:21:27 57037 196.168.1.1 - - 196.168.1.1 196.168.1.1 Unavailable - tcp_error DENIED \"Technology/Internet\" - 503 TCP_ERR_MISS GET - http detectportal.firefox.com 80 /success.txt - txt \"Mozilla/5.0 (Windows NT 10.0; WOW64; rv:52.0) Gecko/20100101 Firefox/52.0\" 196.168.1.1 1206 293 - \"none\" \"none\" - - - none - - unavailable - Transparent \"WA-SP-A_Standard-Allow\" 196.168.1.1 none - \"en;q=0.5\"\r\n2018-02-02 22:21:27 60727 196.168.1.1 - - 196.168.1.1 196.168.1.1 Unavailable - tcp_error DENIED \"Technology/Internet\" - 503 TCP_ERR_MISS GET - http detectportal.firefox.com 80 /success.txt - txt \"Mozilla/5.0 (Windows NT 10.0; WOW64; rv:52.0) Gecko/20100101 Firefox/52.0\" 196.168.1.1 1206 293 - \"none\" \"none\" - - - none - - unavailable - Transparent \"WA-SP-A_Standard-Allow\" 196.168.1.1 none - \"en;q=0.5\"\r\n2018-02-02 22:21:27 53776 196.168.1.1 - - 196.168.1.1 196.168.1.1 Unavailable - tcp_error DENIED \"Technology/Internet\" - 503 TCP_ERR_MISS GET - http detectportal.firefox.com 80 /success.txt - txt \"Mozilla/5.0 (Windows NT 10.0; WOW64; rv:52.0) Gecko/20100101 Firefox/52.0\" 196.168.1.1 1206 293 - \"none\" \"none\" - - - none - - unavailable - Transparent \"WA-SP-A_Standard-Allow\" 196.168.1.1 none - \"en;q=0.5\"\r\n2018-02-02 22:21:27 60502 196.168.1.1 - - 196.168.1.1 196.168.1.1 Unavailable - tcp_error DENIED \"Technology/Internet\" - 503 TCP_ERR_MISS GET - http detectportal.firefox.com 80 /success.txt - txt \"Mozilla/5.0 (Windows NT 10.0; WOW64; rv:52.0) Gecko/20100101 Firefox/52.0\" 196.168.1.1 1206 293 - \"none\" \"none\" - - - none - - unavailable - Transparent \"WA-SP-A_Standard-Allow\" 196.168.1.1 none - \"en;q=0.5\"\r\n2018-02-02 22:21:27 47599 196.168.1.1 - - 196.168.1.1 196.168.1.1 Unavailable - tcp_error DENIED \"Technology/Internet\" - 503 TCP_ERR_MISS GET - http detectportal.firefox.com 80 /success.txt - txt \"Mozilla/5.0 (Windows NT 10.0; WOW64; rv:52.0) Gecko/20100101 Firefox/52.0\" 196.168.1.1 1206 293 - \"none\" \"none\" - - - none - - unavailable - Transparent \"WA-SP-A_Standard-Allow\" 196.168.1.1 none - \"en;q=0.5\"\r\n2018-02-02 22:21:27 65759 196.168.1.1 - - 196.168.1.1 196.168.1.1 Unavailable - tcp_error DENIED \"Technology/Internet\" - 503 TCP_ERR_MISS GET - http detectportal.firefox.com 80 /success.txt - txt \"Mozilla/5.0 (Windows NT 10.0; WOW64; rv:52.0) Gecko/20100101 Firefox/52.0\" 196.168.1.1 1206 293 - \"none\" \"none\" - - - none - - unavailable - Transparent \"WA-SP-A_Standard-Allow\" 196.168.1.1 none - \"en;q=0.5\"\r\n2018-02-02 22:21:27 94786 196.168.1.1 - - 196.168.1.1 196.168.1.1 Unavailable - tcp_error DENIED \"Technology/Internet\" - 503 TCP_ERR_MISS GET - http detectportal.firefox.com 80 /success.txt - txt \"Mozilla/5.0 (Windows NT 10.0; WOW64; rv:52.0) Gecko/20100101 Firefox/52.0\" 196.168.1.1 1206 293 - \"none\" \"none\" - - - none - - unavailable - Transparent \"WA-SP-A_Standard-Allow\" 196.168.1.1 none - \"en;q=0.5\"\r\n2018-02-02 22:21:27 28385 196.168.1.1 - - 196.168.1.1 196.168.1.1 Unavailable - tcp_error DENIED \"Technology/Internet\" - 503 TCP_ERR_MISS GET - http detectportal.firefox.com 80 /success.txt - txt \"Mozilla/5.0 (Windows NT 10.0; WOW64; rv:52.0) Gecko/20100101 Firefox/52.0\" 196.168.1.1 1206 293 - \"none\" \"none\" - - - none - - unavailable - Transparent \"WA-SP-A_Standard-Allow\" 196.168.1.1 none - \"en;q=0.5\""}